Unique URL,Nation Name,WA Category,Civil Rights,Economy,Political Freedom
nation=ruzbi,The Zombie Darklight Nation of Ruzbi,Left-wing Utopia,Superb,Frightening,Superb
nation=anhaizlhislhe,The Zombie Darklight Nation of Anhaizlhislhe,Left-wing Utopia,Superb,Frightening,Excessive
nation=lhurzcuuase,The Zombie Darklight Nation of Lhurzcuuase,Left-wing Utopia,Superb,Frightening,Superb
nation=angakluk,The Free Land of Angakluk,Scandinavian Liberal Paradise,Superb,Weak,Excellent
nation=socialist_columbia,The Commonwealth of Socialist Columbia,Scandinavian Liberal Paradise,Superb,Frightening,Good
nation=lotorkedia,The Republic of Lotorkedia,Civil Rights Lovefest,World Benchmark,Frightening,Excessive
nation=nhusjhrazrhilhe,The Zombie Darklight Nation of Nhusjhrazrhilhe,Left-wing Utopia,Superb,Frightening,World Benchmark
nation=the_monterey_bay_aquarium,The Environmentalists of The Monterey Bay Aquarium,Democratic Socialists,Very Good,Frightening,Very Good
nation=twilightlicious,The People's Republic of Twilightlicious,Left-wing Utopia,Excellent,Frightening,World Benchmark
nation=country_197,The Unknown Sovereign State of Country 197,Left-wing Utopia,Excellent,Frightening,Superb
nation=anhzbeur,The Zombie Darklight Nation of Anhzbeur,Left-wing Utopia,Superb,Frightening,World Benchmark
nation=liecthenbourg,The Kylarite Meme of Liecthenbourg,Civil Rights Lovefest,Superb,Frightening,World Benchmark
nation=diplomatic_territories,The East Asian Commune of Diplomatic Territories,Left-wing Utopia,Frightening,Frightening,Excessive
nation=new_jamiea,The Quokka Isles And Republic of New Jamiea,New York Times Democracy,Excellent,Frightening,Superb
nation=eriadni,The People's Republic of Eriadni,Scandinavian Liberal Paradise,World Benchmark,Frightening,Very Good
nation=jharznelhe,The Zombie Darklight Nation of Jharznelhe,Left-wing Utopia,Superb,Frightening,World Benchmark
nation=acuaznharine,The Zombie Darklight Nation of Acuaznharine,Left-wing Utopia,Superb,Frightening,World Benchmark
nation=cizlhrine,The Zombie Darklight Nation of Cizlhrine,Left-wing Utopia,Superb,Frightening,World Benchmark
nation=jabhezilhe,The Zombie Darklight Nation of Jabhezilhe,Left-wing Utopia,Superb,Frightening,World Benchmark
nation=beatrixia,The Volksrepublik of Beatrixia,Democratic Socialists,Very Good,Frightening,Excellent
nation=lhazafeizlhe,The Zombie Darklight Nation of Lhazafeizlhe,Left-wing Utopia,Superb,Frightening,Excessive
nation=fauzjhiauzilhe,The Zombie Darklight Nation of Fauzjhiauzilhe,Left-wing Utopia,Superb,Frightening,World Benchmark
nation=wampummariut,The Stellar Hives of Wampummariut,Inoffensive Centrist Democracy,Excellent,Frightening,Excellent
nation=arimbia,The Pink Free Land of Arimbia,Scandinavian Liberal Paradise,World Benchmark,Frightening,Very Good
nation=alnhaunzbhilhe,The Zombie Darklight Nation of Alnhaunzbhilhe,Left-wing Utopia,World Benchmark,Frightening,Superb
nation=zellatia,The Democratic Empire of Zellatia,Left-Leaning College State,Superb,Frightening,Excellent
nation=tsvetania,The Empire of Tsvetania,Civil Rights Lovefest,World Benchmark,Frightening,World Benchmark
nation=merriwhether,The Free Democratic Republic of Merriwhether,Left-wing Utopia,Excellent,Frightening,Superb
nation=north_insomnia,The Holy Empire of North Insomnia,Democratic Socialists,Excellent,Frightening,Very Good
