Unique URL,Nation Name,WA Category,Civil Rights,Economy,Political Freedom
nation=esterlon,The Integrated Protectorate of Esterlon,Inoffensive Centrist Democracy,Below Average,Frightening,Some
nation=naive_schoolgirls,The Academia Tyrannica of Naive Schoolgirls,Psychotic Dictatorship,Outlawed,Frightening,Outlawed
nation=respublika_serbska,The Theocracy of Respublika SErbska,Corporate Police State,Unheard Of,Frightening,Unheard Of
nation=rakbibistan,The Holy Empire of RakBibiStan,Corporate Police State,Unheard Of,Frightening,Unheard Of
nation=sporda,The Kingdom of Sporda,Corporate Police State,Few,Frightening,Rare
nation=huntfield-hackham_bogans,The Community of Huntfield-Hackham Bogans,Corporate Police State,Few,Frightening,Unheard Of
nation=scuffleopolis,The Oppressed Peoples of Scuffleopolis,Iron Fist Consumerists,Unheard Of,Frightening,Unheard Of
nation=cerberion,The Uninspired nation type of Cerberion,Corporate Police State,Outlawed,Frightening,Unheard Of
nation=tobelade,The State-Mandated Utopia of Tobelade,Corporate Police State,Unheard Of,Frightening,Outlawed
nation=stevid,The Holy Empire of Stevid,Moralistic Democracy,Some,Frightening,Some
nation=yraipotnoj,The Serene Deliberations of Yraipotnoj,Left-wing Utopia,Excellent,Frightening,Excellent
nation=fauntenheddo,The Corporatocracy of Fauntenheddo,Inoffensive Centrist Democracy,Good,Frightening,Some
nation=fa_niente,The Donald Trump USA Dystopia of Fa Niente,Compulsory Consumerist State,Some,Frightening,Rare
nation=the_allied_states,The Armed Republic of The Allied States,Father Knows Best State,Very Good,Frightening,Rare
nation=machina_haruspex,The Sovereign Imperium of Machina Haruspex,Mother Knows Best State,Average,Frightening,Few
nation=the_bonum_commune_institute,The Technocracy of The Bonum commune Institute,Psychotic Dictatorship,Unheard Of,Frightening,Unheard Of
nation=city_states_nation,The Union of City States Nation,Inoffensive Centrist Democracy,Very Good,Frightening,Average
nation=siegrune,The Soviet Satellite State of Siegrune,Iron Fist Consumerists,Outlawed,Frightening,Outlawed
nation=haja-mishu,The Atrahasian Republic of Haja-Mishu,Capitalizt,Superb,Frightening,Excellent
nation=portugal_is_great,The Imperial Empire of Portugal Is Great,Corporate Police State,Unheard Of,Frightening,Unheard Of
nation=i_am_batman,The Hallowed States of I am Batman,Corporate Police State,Unheard Of,Frightening,Outlawed
nation=ice_800,The Infinite Supply of Ice 800,Libertarian Police State,Excellent,Frightening,Few
nation=falapatorius,The Undead Zombie Empire of Falapatorius,Anarchy,Frightening,Frightening,World Benchmark
nation=reedian,The Divine Republic of Reedian,Corrupt Dictatorship,Below Average,Frightening,Rare
nation=velstado,The Trustworthy Corporate Hydra of Velstado,Anarchy,Superb,Frightening,Superb
nation=rhinara,The Star Sovereignty of Rhinara,Iron Fist Consumerists,Few,All-Consuming,Rare
nation=hyperseptentrionalis,The Commonwealth of Hyperseptentrionalis,Iron Fist Consumerists,Rare,Frightening,Outlawed
nation=first_marketing_and_export,The Old Fashioned Peanut Gallery of First Marketing and Export,Moralistic Democracy,Few,Very Strong,Some
nation=immeel,The Empire of Immeel,Corporate Police State,Few,Frightening,Unheard Of
nation=retarded_sklaven,The Holy Divine Feheur of Retarded Sklaven,Corporate Police State,Few,Frightening,Rare
nation=harmonic_empire,The Grand Diarchy of Harmonic Empire,Corporate Police State,Few,Frightening,Rare
nation=the_infernum,The Great Pit of The Infernum,Capitalist Paradise,Average,Frightening,Some
nation=xjaviria,The Armed Corporation of Xjaviria,Corporate Police State,Rare,Frightening,Outlawed
nation=lowell_leber,The Aristocratic Regime of Lowell Leber,Capitalist Paradise,Below Average,Frightening,Very Good
nation=rethan,The Stygian Malignancy of Rethan,Corporate Police State,Rare,Frightening,Outlawed
nation=neoegypt,The United Kingdom of NeoEgypt,Compulsory Consumerist State,Good,Frightening,Few
nation=reorganisieren_reichregierung,The Neue Kaiserliche Ordnung of Reorganisieren Reichregierung,Corporate Police State,Rare,Frightening,Rare
nation=hicksler,The Empire of Hicksler,Corporate Police State,Outlawed,Frightening,Unheard Of
nation=yngir,The Empire of Yngir,Iron Fist Consumerists,Rare,Frightening,Unheard Of
nation=cappirt,The Corporatocracy of Cappirt,Anarchy,Superb,Frightening,Excessive
nation=nihilismicus,The Empire of Nihilismicus,Psychotic Dictatorship,Outlawed,Frightening,Outlawed
nation=delberz,The Hegemony of Delberz,Iron Fist Consumerists,Few,Frightening,Outlawed
nation=lolfreedomz,The Rogue Nation of Lolfreedomz,Compulsory Consumerist State,Very Good,Frightening,Unheard Of
nation=gray_army,The First Galactic Empire of Gray Army,Inoffensive Centrist Democracy,Average,Frightening,Some
nation=qebui,The Dominion of Qebui,Corporate Police State,Unheard Of,Frightening,Outlawed
nation=western_scientificum,The Holy Orange Primitocracy of Western Scientificum,Iron Fist Consumerists,Some,Frightening,Rare
nation=yajland,The Dictatorship of Yajland,Corporate Police State,Unheard Of,Frightening,Unheard Of
nation=jalliala,The Depressing Hellscape of Jalliala,Psychotic Dictatorship,Outlawed,Frightening,Outlawed
nation=the_binary_evil_dictatorship,The Corporate Executive Council of The Binary Evil Dictatorship,Corporate Police State,Unheard Of,Frightening,Unheard Of
nation=armacor,The Conglomerate of Armacor,Capitalizt,Superb,Frightening,Good
nation=kansk,The Confederacy of Kansk,Capitalist Paradise,Very Good,Frightening,Excellent
nation=billybee,The Economic Juggernaut of BillyBee,Capitalist Paradise,Some,Frightening,Good
nation=deamonopolis,The Territory of Deamonopolis,Iron Fist Consumerists,Unheard Of,Frightening,Unheard Of
nation=maniaca,The Blessed Kingdom of Maniaca,Benevolent Dictatorship,Superb,Frightening,Outlawed
nation=kingdinium,The Dominion of Kingdinium,Iron Fist Consumerists,Few,Frightening,Rare
nation=wwe_town,The Nation of Domination of WWE Town,Iron Fist Consumerists,Few,Frightening,Unheard Of
nation=the_pact_of_terra,The Empire of The Pact of Terra,Inoffensive Centrist Democracy,Below Average,Frightening,Some
nation=absolutly_terrible,The Failed Social Experiment of Absolutly Terrible,Iron Fist Consumerists,Unheard Of,Frightening,Rare
nation=futurus,The Aristocracy of Futurus,Corporate Bordello,Some,Frightening,Widely Abused
nation=lemmingcus_meenicus,The Psychotic Dictatorship of Lemmingcus Meenicus,Corporate Police State,Unheard Of,Frightening,Outlawed
nation=keklystan,The Militaristic Dictatorship of Keklystan,Corporate Police State,Outlawed,Frightening,Unheard Of
nation=olde_english_800,The Bottles Full of Olde English 800,Inoffensive Centrist Democracy,Very Good,Frightening,Good
nation=konzum_k-plus,The Shopping Mall Tyranny of Konzum K-plus,Iron Fist Consumerists,Outlawed,Frightening,Unheard Of
nation=vargin-dackey,The Empire Paramount of Vargin-Dackey,Iron Fist Consumerists,Outlawed,Frightening,Unheard Of
nation=commonwealth_states_of_britania,The Jagiellonian Union of Commonwealth States of Britania,Left-Leaning College State,Superb,Frightening,Excellent
nation=gocss,The Turbocharged Economic Power of Gocss,Compulsory Consumerist State,Below Average,Frightening,Rare
nation=yansu,The Corgimancer and Mob Boss of Yansu,Anarchy,World Benchmark,Frightening,Excessive
nation=charcoaltropolis,The Grand Republic of Charcoaltropolis,Inoffensive Centrist Democracy,Average,Frightening,Very Good
nation=vespertilia,The Cannibalicracy of Vespertilia,Civil Rights Lovefest,Frightening,Frightening,World Benchmark
nation=vargr_corsairs,The Confederacy of Vargr Corsairs,New York Times Democracy,Excellent,Frightening,Superb
nation=the_algarve,The Really Hot Lands of The Algarve,Iron Fist Consumerists,Unheard Of,Frightening,Rare
nation=vapidistan,The Caliphate of Vapidistan,Iron Fist Consumerists,Outlawed,Fragile,Unheard Of
nation=asgarnnia,The Armed Junta of Asgarnnia,Compulsory Consumerist State,Excellent,Frightening,Unheard Of
nation=lunavarius,The Incorporated States of Lunavarius,Compulsory Consumerist State,Some,Frightening,Rare
nation=angst_insel,The State of Angst Insel,Corporate Police State,Some,Frightening,Rare
nation=chalian_islands,The Capitalistic Archipelago of Chalian Islands,Inoffensive Centrist Democracy,Good,Frightening,Some
nation=roguean,The Empire of Roguean,Iron Fist Consumerists,Unheard Of,Frightening,Outlawed
nation=random_one,The GV Corporal of Random One,Iron Fist Consumerists,Few,Frightening,Rare
nation=namjyut,The Kingdom of Namjyut,Compulsory Consumerist State,Some,Frightening,Unheard Of
nation=coreys_land,The Dictatorship of Coreys Land,Iron Fist Consumerists,Unheard Of,Very Strong,Rare
nation=mordor,The Nameless Land of Mordor,Corporate Police State,Unheard Of,Frightening,Outlawed
nation=empire_of_a_million_suns,The Empire of Empire of a Million Suns,Iron Fist Consumerists,Few,Frightening,Unheard Of
nation=the_grand_world_order,The Fascist Federation of The Grand World Order,Iron Fist Consumerists,Few,Frightening,Unheard Of
nation=mavenheim,The People's Kingdom of Mavenheim,Benevolent Dictatorship,Excessive,Frightening,Few
nation=captain_lard,The Fat of Captain Lard,Corporate Police State,Rare,Frightening,Rare
nation=autarkheia,The Incorporated States of Autarkheia,Iron Fist Consumerists,Outlawed,Frightening,Outlawed
nation=empires_empire,The Imperial Fortress World of Empires Empire,Benevolent Dictatorship,Excessive,Frightening,Unheard Of
nation=lenzum,The Grand Empire of Lenzum,Father Knows Best State,Average,Frightening,Outlawed
