Unique URL,Nation Name,WA Category,Civil Rights,Economy,Political Freedom
nation=kindjal,The Queendom of Kindjal,Left-wing Utopia,Excellent,Weak,Superb
nation=tzo,The Just of Tzo,Left-wing Utopia,Superb,Fair,Excessive
nation=pax_aurea,The Federal Commonwealth of Pax Aurea,Left-wing Utopia,World Benchmark,Frightening,Excessive
nation=wilkshire,The Republic of Wilkshire,Scandinavian Liberal Paradise,Superb,Frightening,Very Good
nation=st_stephen_n_critters,The Community of St Stephen n Critters,Left-wing Utopia,World Benchmark,Developing,Superb
nation=divine_cervine,The Benevolent Queendom of Divine Cervine,Democratic Socialists,Below Average,Frightening,Good
nation=deep_south_borland,The Holiest of the Holy Lands of Deep South Borland,Authoritarian Democracy,Outlawed,Imploded,Some
nation=ral_ixshida,The Ral System Capital World of Ral Ixshida,Liberal Democratic Socialists,Excellent,Frightening,Superb
nation=blogotopia,The Anarchy of Blogotopia,Left-Leaning College State,Superb,Frightening,Very Good
nation=applejacky,The Agricultural Paradise of AppleJacky,Scandinavian Liberal Paradise,Excellent,Frightening,Excellent
nation=timao,The Fielzão of Timao,New York Times Democracy,Excellent,Strong,Superb
nation=cyrenean,The Island of Cyrenean,Civil Rights Lovefest,World Benchmark,Frightening,World Benchmark
nation=thalasse,The PS2 Puppet of Thalasse,Liberal Democratic Socialists,Very Good,Frightening,Excellent
nation=dialland,The Republic of Dialland,Democratic Socialists,Very Good,Frightening,Very Good
nation=marimite,The Bara Loving Free Land of Marimite,New York Times Democracy,Good,Reasonable,Excellent
nation=kyupaa,The Republic of Kyupaa,Democratic Socialists,Very Good,Imploded,Very Good
nation=mograpelandia,The Idyllic Paradise of Mograpelandia,Inoffensive Centrist Democracy,Very Good,Frightening,Very Good
nation=corcaw,The Republic of Corcaw,Liberal Democratic Socialists,Very Good,Frightening,Superb
nation=free_socialism,The Culture of Free Socialism,Left-wing Utopia,World Benchmark,Frightening,Excessive
nation=papajacky,The Dominion of PapaJacky,Democratic Socialists,Excellent,Frightening,Very Good
nation=omegadrax,The Dystopic World Nation of Omegadrax,Civil Rights Lovefest,Excessive,Frightening,Excessive
nation=span,The United Socialist States of Span,Civil Rights Lovefest,Excessive,Thriving,Superb
nation=mexican_liberation,The Grand Imperium of Divinity of Mexican Liberation,Left-wing Utopia,Frightening,Frightening,Widely Abused
nation=outer_sparta,The Kingdom of Outer Sparta,Liberal Democratic Socialists,Excellent,Frightening,Excellent
nation=ratateague,The SLUthing of Ratateague,Left-wing Utopia,Superb,Frightening,Superb
nation=safj,The Serene Compassionate Utopia of Safj,Civil Rights Lovefest,World Benchmark,Frightening,Superb
nation=schala,The Disputed Territories of Schala,Corrupt Dictatorship,Below Average,Frightening,Unheard Of
nation=kilobugya,The Socialist Republic of Kilobugya,Left-wing Utopia,Superb,Strong,Superb
nation=winklebottom,The Federal Republic of Winklebottom,Liberal Democratic Socialists,Excellent,Frightening,World Benchmark
nation=the_clockwork_republic,The Technocracy of The Clockwork Republic,Democratic Socialists,Excellent,Frightening,Excellent
nation=elejamie,The Unified Tracts of Elejamie,Civil Rights Lovefest,Excessive,Frightening,Superb
nation=vancovaria,The Federal Democratic Republic of Vancovaria,Left-wing Utopia,Excessive,Frightening,Superb
nation=eastfield_lodge,The Imperial Commonwealth of Eastfield Lodge,Democratic Socialists,Average,Frightening,Good
nation=alvestad,The Community of Alvestad,Liberal Democratic Socialists,Excellent,Frightening,Excellent
nation=tierra_del_queso,The Commonwealth of Tierra del Queso,Left-wing Utopia,World Benchmark,Frightening,Superb
nation=ummagumma,The Nihilist Hippy Commune of Ummagumma,Left-wing Utopia,Superb,Frightening,Superb
nation=countriopia,The Democratic Republic of Countriopia,Liberal Democratic Socialists,Very Good,Frightening,Superb
nation=minahasa,The Confederated Communes of Minahasa,Left-wing Utopia,Excessive,Frightening,World Benchmark
nation=the_iger_civilization,The Cosmopolitan State of The IGER Civilization,Left-wing Utopia,Excellent,Frightening,Superb
nation=lunheizria,The Zombie Fauzjhian Province of Lunheizria,Left-wing Utopia,Superb,Frightening,World Benchmark
nation=taineizbria,The Zombie Fauzjhian Province of Taineizbria,Left-wing Utopia,Superb,Frightening,World Benchmark
nation=bhrazjhia,The Zombie Fauzjhian Provincie of Bhrazjhia,Left-wing Utopia,Superb,Frightening,Superb
nation=kaigi,The Kingdom of Kaigi,Corrupt Dictatorship,Very Good,Frightening,Few
nation=nelvana_iii,The People's Woodlands of Nelvana III,Democratic Socialists,Excellent,Frightening,Excellent
nation=auceanznia,The Zombie Fauzjhian Province of Auceanznia,Left-wing Utopia,Superb,Frightening,Superb
nation=equgothic_nation,The United Individuals of EquGothic Nation,Democratic Socialists,Average,Imploded,Good
nation=saltanyas,The Republic of Saltanyas,Left-wing Utopia,Frightening,Frightening,Corrupted
nation=rugelia,The Empire of Rugelia,Democratic Socialists,Excellent,Powerhouse,Very Good
nation=genesis_fifteen,The Socialist Federation of Genesis Fifteen,Left-wing Utopia,Frightening,Frightening,Superb
nation=trotterdam,The Principality of Trotterdam,Left-Leaning College State,Superb,Frightening,Excellent
nation=evilcia,The Zombie Prolife Kingdom of Evilcia,Left-wing Utopia,Superb,Frightening,Superb
nation=the_menapii,The Civitas of The Menapii,Liberal Democratic Socialists,Very Good,Frightening,Superb
nation=smithstopia,The Federation of Smithstopia,Civil Rights Lovefest,Frightening,Frightening,Superb
nation=zerophix,The Hippy State of Zerophix,Scandinavian Liberal Paradise,World Benchmark,Imploded,Excellent
nation=fauzjhia,The Communist Easter Egg Kingdom of Fauzjhia,Left-wing Utopia,Superb,Frightening,Superb
nation=tokora,The Democratic Republic of Tokora,Democratic Socialists,Good,Frightening,Good
nation=rolass,The World State Empire of ROLASS,Psychotic Dictatorship,Few,Frightening,Unheard Of
nation=liberal_liberals,The CUP-Eladeni Isocracy of Liberal Liberals,Left-wing Utopia,World Benchmark,Fragile,Superb
nation=the_ctan_species,The ExaCivilization of The Ctan Species,Democratic Socialists,Excellent,Frightening,Excellent
nation=calavis,The DoGooder Intentions of Calavis,Democratic Socialists,Below Average,Frightening,Some
nation=pakitsk,The Welfarist Vizierdom of Pakitsk,Scandinavian Liberal Paradise,Superb,Frightening,Good
nation=arztroska,The Free Land of Arztroska,Left-wing Utopia,World Benchmark,Frightening,World Benchmark
nation=respublica_veneta,The Modern Consulship of Respublica Veneta,Left-wing Utopia,Superb,Frightening,Superb
nation=typica,The Majestic Forest of Typica,Left-wing Utopia,Excessive,Frightening,World Benchmark
nation=ninjitsutopia,The Revolutionary Federation of NinjitsUtopia,Scandinavian Liberal Paradise,Excellent,Frightening,Excellent
nation=arqhua,The Artificial Intelligence of Arqhua,Left-wing Utopia,Superb,Frightening,Superb
nation=bolian_island,The People's Unions of Bolian island,Liberal Democratic Socialists,Excellent,Frightening,Superb
nation=united_provinces_of_atlantica,The Most Serene Jarldom of United Provinces of Atlantica,Left-wing Utopia,Superb,Frightening,Superb
nation=gothlandia,The Grand Duchy of Gothlandia,Scandinavian Liberal Paradise,World Benchmark,Frightening,Excellent
nation=rahul_raghuraman,The Articulate Republic of Rahul Raghuraman,Left-Leaning College State,Superb,Frightening,Very Good
nation=zombiedolphins,The Republic of Zombiedolphins,Civil Rights Lovefest,Superb,Frightening,Superb
nation=zavea,The Federation of Zavea,Democratic Socialists,Good,Frightening,Below Average
nation=west_green_israel,The Federal Republic of West green Israel,Left-wing Utopia,Excellent,Frightening,World Benchmark
nation=nostalgia_13,The Free Land of Nostalgia 13,Left-wing Utopia,Excellent,Frightening,Superb
nation=chedonia,The Democratic Republic of Chedonia,Scandinavian Liberal Paradise,Superb,Frightening,Excellent
nation=xiashu,The Peaceful collective of Xiashu,Liberal Democratic Socialists,Very Good,All-Consuming,Superb
nation=gracieland,The Free Association of Gracieland,Scandinavian Liberal Paradise,Superb,Imploded,Good
nation=simolandia,The Ominous rumblings of Simolandia,Democratic Socialists,Excellent,All-Consuming,Average
nation=the_palace_of_god_2,The Federal Sovereign State of The palace of God 2,Democratic Socialists,Very Good,Frightening,Excellent
nation=senshu,The Republic of Senshu,Left-wing Utopia,Superb,Very Strong,Superb
nation=iontan,The United Islands of Iontan,Left-wing Utopia,Superb,Frightening,Excellent
nation=omegashenron,The Holy Pink Zombie of OmegaShenron,Democratic Socialists,Excellent,Frightening,Very Good
nation=kerla,The Socialist Union of Kerla,Left-wing Utopia,Excellent,Frightening,Superb
nation=red_dome,The Colony of Red Dome,Democratic Socialists,Good,All-Consuming,Excellent
nation=socialist_tigray,The People's Republic of Socialist Tigray,Left-wing Utopia,Superb,Frightening,Superb
nation=universal_utopian_state,The Socialist Empire of Universal Utopian State,Democratic Socialists,Very Good,Frightening,Very Good
nation=emailistan,The United Socialist States of Emailistan,Left-wing Utopia,Excellent,Frightening,Excellent
nation=kisume_the_bucket_youkai,The Matriarchy of Kisume the bucket youkai,Left-wing Utopia,Superb,Frightening,Superb
nation=independent_planets,The Concordium of Independent Planets,Democratic Socialists,Very Good,Frightening,Good
nation=chemung,The Christmas Zombie Horde of Chemung,Liberal Democratic Socialists,Very Good,Frightening,Superb
nation=all_are_equal,The Democratic Republic of All are Equal,Democratic Socialists,Very Good,Frightening,Good
nation=ten_empires,The Alliance of Ten Empires,Democratic Socialists,Excellent,Frightening,Excellent
nation=neldessica,The Republic of Neldessica,Democratic Socialists,Below Average,Fragile,Good
nation=saganye,The Oil Painted Joy of Saganye,Democratic Socialists,Excellent,Frightening,Excellent
nation=sharpanistan,The Common Sense Republic of Sharpanistan,Civil Rights Lovefest,Excessive,Frightening,Excessive
nation=truechristianity,The Harmonious Political Haven of TrueChristianity,Tyranny by Majority,Few,Imploded,World Benchmark
nation=new_camelot_of_avalonia,The Imperial Welfare Union of New Camelot of Avalonia,Left-wing Utopia,Excessive,Frightening,Excessive
nation=benjamin_mark,The Second Commonwealth of Benjamin Mark,Inoffensive Centrist Democracy,Very Good,Frightening,Very Good
nation=united_states_of_americanas,The Democratic Society of United States of Americanas,Left-wing Utopia,Superb,Frightening,Superb
nation=kwabena_kingdom,The New Constitutional Monarchy of Kwabena Kingdom,Democratic Socialists,Excellent,Frightening,Excellent
nation=the_crooked_beat,The People's Republic of The Crooked Beat,Left-wing Utopia,World Benchmark,Frightening,Superb
nation=yaorozu,The Rising Sun's Land of Yaorozu,Authoritarian Democracy,Few,Frightening,Below Average
nation=innato,The Matriarchy of Innato,Civil Rights Lovefest,Superb,Frightening,World Benchmark
nation=fortune1,The Nak Nakian WA Embassy of Fortune1,Civil Rights Lovefest,Superb,Reasonable,Excellent
nation=alanis_star,The Clarissa's Vagrant Persona of Alanis Star,Liberal Democratic Socialists,Good,Frightening,Excellent
nation=kombinita_socialisma_demokratio,The Popolujo of Kombinita Socialisma Demokratio,Liberal Democratic Socialists,Excellent,Frightening,Superb
nation=the_astral_eternals,The Most Serene Republic of The Astral Eternals,Scandinavian Liberal Paradise,Superb,Frightening,Very Good
nation=mushcap,The Heteregality of Mushcap,Left-Leaning College State,Excellent,Frightening,Very Good
nation=territorio_di_nessuno,The Disputed Territories of Territorio di Nessuno,Left-wing Utopia,Superb,Frightening,World Benchmark
nation=apostolic_see,The Sede Vacante of Apostolic see,Liberal Democratic Socialists,Below Average,Frightening,Excellent
nation=herya,The Empire of Herya,Civil Rights Lovefest,Superb,Frightening,World Benchmark
nation=misplaced_states,The Obscurely Profound Confusion of Misplaced States,Democratic Socialists,Average,Imploded,Excellent
nation=milostein,The Kingdom of Milostein,Democratic Socialists,Excellent,Frightening,Good
nation=half-milers,The Classy Realm of Half-Milers,Civil Rights Lovefest,Frightening,Frightening,Widely Abused
nation=trotskya,The Workers' Democracy of Trotskya,Civil Rights Lovefest,World Benchmark,Frightening,Superb
nation=western_arab_empire,The Islamic Caliphate of Western Arab Empire,Democratic Socialists,Some,Frightening,Excellent
nation=north_cross,The White Crowned Boreal Lights of North Cross,Left-wing Utopia,Superb,Frightening,World Benchmark
nation=theorin,The Dracocracy of Theorin,New York Times Democracy,Average,Frightening,Excellent
nation=farrakhan,The Holy Empire of Farrakhan,Democratic Socialists,Excellent,Frightening,Very Good
nation=discgolfland,The Smokin Green Land of DiscGolfLand,Left-wing Utopia,World Benchmark,Frightening,Superb
nation=dutchyland,The Mystical Isles of Dutchyland,Scandinavian Liberal Paradise,Superb,Frightening,Excellent
nation=united_nations_of_earth_federation,The United Allied States of United Nations of Earth Federation,Left-wing Utopia,Superb,Frightening,Superb
nation=biotopia,The Commonwealth of Biotopia,Inoffensive Centrist Democracy,Excellent,Frightening,Very Good
nation=nazbeth,The BLM of Nazbeth,Left-wing Utopia,Superb,Frightening,World Benchmark
nation=nostovya,The Free Land of Nostovya,Left-wing Utopia,Superb,Frightening,World Benchmark
nation=leviatha,The Socialist Democracy of Leviatha,Left-wing Utopia,Excellent,Frightening,Excellent
nation=ferrianona,The Green Regency of Ferrianona,Democratic Socialists,Some,Frightening,Average
nation=che_triumphant,The Sanctuary of Che Triumphant,Democratic Socialists,Very Good,Frightening,Good
nation=zachtia,The Human-Pony Alliance of Zachtia,Left-wing Utopia,Excellent,Frightening,Superb
nation=ubiquistania,The Allied Green and Red States of Ubiquistania,Civil Rights Lovefest,Superb,Frightening,Excellent
nation=culture_of_life,The Christian Democratic Nation of Culture of Life,Liberal Democratic Socialists,Average,Frightening,Superb
nation=sirian,The Democratic Socialist States of Sirian,Left-Leaning College State,Superb,Frightening,Good
nation=voxum_mortalum,The Order of Voxum Mortalum,Civil Rights Lovefest,Superb,Frightening,Superb
nation=equa_lib,The Classless Free Land of Equa Lib,Left-wing Utopia,World Benchmark,Frightening,Widely Abused
nation=auravel,The Realm of Auravel,Left-wing Utopia,Excellent,Frightening,Superb
nation=kershya,The Constitutional Monarchy of Kershya,Scandinavian Liberal Paradise,Excellent,Frightening,Very Good
nation=zulanka,The Workers' State of Zulanka,Left-wing Utopia,Frightening,Frightening,Excessive
nation=holy_theocracy_of_the_endocrine,The Cheeky Tease of Holy Theocracy of the Endocrine,Liberal Democratic Socialists,Very Good,Frightening,Superb
nation=g_c_bakura,The Shining Islands of G C Bakura,Scandinavian Liberal Paradise,Excellent,Frightening,Good
nation=thespolis,The Combined Syndicates of Thespolis,Left-wing Utopia,Superb,Frightening,Superb
nation=the_therians,The Universal State of The Therians,Left-wing Utopia,Excellent,Frightening,Excellent
nation=adorable_kittens,The Meadows of Adorable Kittens,Liberal Democratic Socialists,Very Good,Frightening,Superb
nation=yannia,The Nudist States of Yannia,Left-wing Utopia,Excessive,Frightening,Superb
nation=supersloth,The United Socialist States of Supersloth,Scandinavian Liberal Paradise,Superb,Fair,Excellent
nation=holy_oranz,The Ecclesiocracy of Holy Oranz,Left-wing Utopia,Frightening,Frightening,Superb
nation=sankh-lanport,The Free and Independent State of Sankh-Lanport,Left-Leaning College State,Excellent,Frightening,Good
nation=qvait,The Valkyrian Republic of Qvait,Left-wing Utopia,World Benchmark,Frightening,Superb
nation=aequalitia,The Democratic republic of Aequalitia,Civil Rights Lovefest,Superb,Frightening,Superb
nation=the_unionized_stoners,The Soviet Socialist States of The Unionized Stoners,Democratic Socialists,Very Good,Frightening,Very Good
nation=greater_new_indus,The Interdimensional Confederacy of Greater New Indus,Left-wing Utopia,Frightening,Frightening,Widely Abused
nation=libertarian_communist_planets,The United Federation of Libertarian Communist Planets,Left-wing Utopia,Excessive,Frightening,Superb
nation=jaksmouth,The Tyu of Jaksmouth,Inoffensive Centrist Democracy,Very Good,Frightening,Excellent
nation=avaerilon,The Magnificent Kingdom of Avaerilon,Civil Rights Lovefest,Excessive,Frightening,Widely Abused
nation=the_candy_of_bottles,The Rainbow Pony Kingdom of The Candy Of Bottles,Democratic Socialists,Good,Frightening,Average
nation=montmorencia,The Kingdom of Montmorencia,Civil Rights Lovefest,Superb,Frightening,Superb
nation=myledia,The Ever - existing omnistate of Myledia,Left-Leaning College State,Superb,Frightening,Excellent
nation=headpat_central,The Compassionate Republic of Headpat Central,Left-wing Utopia,Excellent,Frightening,Superb
nation=dindrenzi,The Socialist Directorate of Dindrenzi,Democratic Socialists,Very Good,Frightening,Very Good
nation=killerma,The Imperial Empire of Killerma,Liberal Democratic Socialists,Excellent,Fair,Superb
nation=arkletopia,The Most Serene Republic of Arkletopia,Inoffensive Centrist Democracy,Excellent,Frightening,Very Good
nation=republica_de_sasha,The Island of Republica de Sasha,Left-wing Utopia,World Benchmark,Frightening,Corrupted
nation=gerbachanglia,The Spacetime Anomaly of Gerbachanglia,Left-wing Utopia,Superb,Frightening,Superb
nation=the_andromachean_entente,The Aristotelian Parpolity of The Andromachean Entente,Left-wing Utopia,Superb,Frightening,World Benchmark
nation=the_grene_knyght,The Alien Lullaby of The Grene Knyght,Left-wing Utopia,Frightening,Frightening,Superb
nation=super_happy_land,The Social Democracy of Super Happy Land,New York Times Democracy,Very Good,Frightening,Excellent
nation=chip_skylark,The Commonwealth of Chip Skylark,Scandinavian Liberal Paradise,Excellent,Frightening,Very Good
nation=the_united_expanse,The Pacifist States of The United Expanse,Left-wing Utopia,Superb,Frightening,World Benchmark
nation=damanucus,The Nomadic Peoples of Damanucus,Democratic Socialists,Very Good,Frightening,Excellent
nation=the_holy_empire_of_the_stars,The Holy Empire of The Holy Empire of the Stars,Democratic Socialists,Very Good,Frightening,Good
nation=ahblahblah,The Principality of Ahblahblah,Scandinavian Liberal Paradise,Superb,Frightening,Very Good
nation=future_cascadia,The Republic of Future Cascadia,Democratic Socialists,Very Good,Frightening,Good
nation=erastide,The Banana Bread Provider of Erastide,Democratic Socialists,Average,Reasonable,Very Good
nation=intlyiatin,The Syndycalist Republic of Intlyiatin,Corrupt Dictatorship,Very Good,Frightening,Few
nation=united_phoenicia,The Free Land of United Phoenicia,Inoffensive Centrist Democracy,Very Good,Frightening,Some
nation=eloren,The Wilderness of Eloren,Left-wing Utopia,Superb,Frightening,World Benchmark
nation=polinikia,The Commonwealth of Polinikia,Democratic Socialists,Some,Imploded,Below Average
nation=outter_micronesia,The Gentle Peoples of Outter Micronesia,Left-Leaning College State,Superb,Imploded,Excellent
nation=minchioria,The Transhuman Communist State of Minchioria,Democratic Socialists,Good,Frightening,Very Good
nation=garden_at_6th_mile_road,The Heldere n Betoverde Dimensie of Garden at 6th Mile Road,Liberal Democratic Socialists,Good,Frightening,Superb
nation=praeceps,The Hoppy of Praeceps,Democratic Socialists,Excellent,Frightening,Very Good
nation=captiotia,The Summatory Socialist Republic of Captiotia,Left-wing Utopia,World Benchmark,Frightening,Excessive
nation=thx1138,The Medicine Cabinet of THX1138,Left-wing Utopia,Superb,Frightening,Excellent
nation=ashenov,The Socialist Federal Republic of Ashenov,Left-wing Utopia,Excessive,Frightening,Excessive
nation=gunfreak,The Empire of Gunfreak,Democratic Socialists,Excellent,Weak,Very Good
nation=cilef,The Atheistic Collective of Cilef,Democratic Socialists,Very Good,Imploded,Very Good
nation=nuevo_meshiko,The Grand Socialist Federation of Nuevo Meshiko,Scandinavian Liberal Paradise,World Benchmark,Frightening,Excellent
nation=smugglers_and_mercs,The Alliance of Smugglers and Mercs,Scandinavian Liberal Paradise,Superb,Frightening,Very Good
nation=arumdaum,The Beautiful Republic of Arumdaum,Left-wing Utopia,World Benchmark,Frightening,Excessive
nation=haven_of_liberty,The Union of Haven of liberty,Left-wing Utopia,Superb,Frightening,Excessive
nation=brillnuck,The Federal Republic of Brillnuck,Civil Rights Lovefest,Excessive,Frightening,Superb
nation=tinis,The Union of Tinis,Liberal Democratic Socialists,Excellent,Imploded,Superb
nation=worldia555,The Republic of Worldia555,Democratic Socialists,Excellent,Frightening,Very Good
nation=frigidopia,The Free Land of Frigidopia,Civil Rights Lovefest,World Benchmark,Frightening,Superb
nation=omnistria,The Epic Revolution of Omnistria,Civil Rights Lovefest,World Benchmark,Frightening,Superb
nation=the_republic_of_invictus,The Democratic Republic of The Republic of Invictus,Liberal Democratic Socialists,Very Good,Frightening,Superb
nation=socialised_capital,The Community of Socialised Capital,Left-wing Utopia,World Benchmark,Frightening,Superb
nation=almonaster_nuevo,The Zombie Hunters of Almonaster Nuevo,Civil Rights Lovefest,World Benchmark,Frightening,Superb
nation=iguanarctica,The PS2 Puppet of Iguanarctica,New York Times Democracy,Very Good,Frightening,Superb
nation=joaco,The Kingdom of Joaco,Liberal Democratic Socialists,Excellent,Frightening,Superb
nation=the_necrontyr,The Eternal Empire of The Necrontyr,Scandinavian Liberal Paradise,Excellent,Frightening,Excellent
nation=meriden,The Republic of Meriden,Left-wing Utopia,Superb,Frightening,Excellent
nation=shaktirajya,The People's Hindu Matriarchy of Shaktirajya,Civil Rights Lovefest,Superb,Frightening,Excellent
nation=the_norwegian_lands,The Democratic Republic of The Norwegian Lands,Inoffensive Centrist Democracy,Excellent,Frightening,Excellent
nation=new_lakemba,The Commonwealth of New Lakemba,Left-wing Utopia,Superb,Frightening,Superb
nation=varavano,The Free Land of Varavano,Civil Rights Lovefest,World Benchmark,Frightening,Excellent
nation=allenstan,The Unpretentious Republic of Allenstan,Democratic Socialists,Below Average,Imploded,Excellent
nation=tolerativ,The Democratic Republic of Tolerativ,Democratic Socialists,Good,Frightening,Some
nation=darths_and_droids,The Webcomic RolePlaying Game of Darths and Droids,Democratic Socialists,Good,Frightening,Some
nation=dioxin,The Plains of Dioxin,Left-Leaning College State,Excellent,Frightening,Below Average
nation=columbia_united,The Federal Republic of Columbia United,Scandinavian Liberal Paradise,Superb,Frightening,Excellent
nation=kiaville,The Democratic States of Kiaville,Left-wing Utopia,Excellent,Frightening,Superb
nation=cenabum,The Republic of Cenabum,Left-wing Utopia,Excessive,Frightening,World Benchmark
nation=cecilly,The Queendom of Cecilly,Left-Leaning College State,Excellent,Frightening,Excellent
nation=crysato,The Free Land of Crysato,Left-wing Utopia,World Benchmark,Frightening,Superb
nation=love_and_nature,The Utopian People's Republic of Love and Nature,Democratic Socialists,Good,Frightening,Excellent
nation=wolfhawk,The Forest Realm of Wolfhawk,Liberal Democratic Socialists,Very Good,Fair,Superb
nation=the_bulgarian_balkans,The Republic of The Bulgarian Balkans,Liberal Democratic Socialists,Very Good,Frightening,World Benchmark
nation=frenequesta,The Scientific Collectives of Frenequesta,Left-wing Utopia,Excessive,Frightening,Superb
nation=utopian_archive,The Community Wealth of Utopian Archive,Liberal Democratic Socialists,Excellent,Frightening,Superb
nation=demmania,The Great Country of Demmania,Left-Leaning College State,Excellent,Frightening,Excellent
nation=complexo,The Numerical Set of Complexo,Democratic Socialists,Excellent,Frightening,Very Good
nation=americolumbia,The Christian Socialist States of Americolumbia,Tyranny by Majority,Few,Frightening,Superb
nation=filmtecknarnia,The Jingoistic States of Filmtecknarnia,Father Knows Best State,Below Average,Thriving,Few
nation=benthamania,The Democratic Republic of Benthamania,Civil Rights Lovefest,Superb,Frightening,Superb
nation=liberal_ukraine,The Empire of Liberal Ukraine,Scandinavian Liberal Paradise,Superb,Frightening,Excellent
nation=southerly,The Republic of Southerly,Left-Leaning College State,Superb,Frightening,Excellent
nation=requand,The Commonwealth of Requand,Scandinavian Liberal Paradise,Excessive,Frightening,Excellent
nation=abhorsenia_and_clayran,The Most Serene Federation of Abhorsenia and Clayran,Civil Rights Lovefest,Excessive,Frightening,Superb
nation=kitsunetown,The Matriarchy of Kitsunetown,Left-wing Utopia,Superb,Frightening,World Benchmark
nation=the_portuguese_workers,The Republic of The Portuguese Workers,Scandinavian Liberal Paradise,World Benchmark,Frightening,Excellent
nation=no_chocia,The Dominion of No Chocia,Democratic Socialists,Excellent,Frightening,Excellent
nation=steenia,The Environmental Protectorate of Steenia,Scandinavian Liberal Paradise,Excellent,Weak,Excellent
nation=torregal,The Pagan Commune of Torregal,Scandinavian Liberal Paradise,Superb,Frightening,Good
nation=bjornoja,The Rogue Nation of Bjornoja,Iron Fist Socialists,World Benchmark,Frightening,Few
nation=anollasia,The Peaceful Republic of Anollasia,New York Times Democracy,Excellent,Frightening,Superb
nation=holy_dolphins,The Cuteness of Holy Dolphins,Democratic Socialists,Some,Imploded,Excellent
nation=larinia,The Fair State of Larinia,Liberal Democratic Socialists,Below Average,Frightening,Superb
nation=kirkensis,The Republic of Kirkensis,Left-wing Utopia,Superb,Frightening,Superb
