Unique URL,Nation Name,WA Category,Civil Rights,Economy,Political Freedom
nation=orwellian_observers,The Unrepublic of Orwellian Observers,Anarchy,Frightening,Frightening,Corrupted
nation=uniftiet,The Republic of Uniftiet,Capitalist Paradise,Good,All-Consuming,Some
nation=big_jim_p,The Satanic Empire of Big Jim P,Libertarian Police State,Excellent,Frightening,Few
nation=testing_nation_44100,The Republic of Testing nation 44100,Father Knows Best State,Some,Frightening,Rare
nation=the_rising_voice,The Voluntary High Republic of The Rising Voice,Corporate Bordello,Excellent,Frightening,Superb
nation=hixoelop,The Grossherzogtum of Hixoelop,Benevolent Dictatorship,Superb,Frightening,Unheard Of
nation=ahfeginsi,The Gold Protectorate of Ahfeginsi,Anarchy,World Benchmark,Thriving,Excessive
nation=succistans,The Individually Wrapped Straws of Succistans,Iron Fist Consumerists,Some,Frightening,Few
nation=the_parthians,The Plutocratic Shahdom of The Parthians,Benevolent Dictatorship,World Benchmark,Frightening,Rare
nation=ambrella,The Sopo Sloth Kingdom of Ambrella,Left-Leaning College State,Superb,Frightening,Very Good
nation=administrative_region_04,The Incorporated States of Administrative Region 04,Moralistic Democracy,Some,All-Consuming,Very Good
nation=pardiamor,The Principality of Pardiamor,Capitalist Paradise,Below Average,Frightening,Some
nation=smitopbot75,The Republic of SmitopBot75,Iron Fist Consumerists,Few,Frightening,Unheard Of
nation=gannukamor,The United Socialist States of Gannukamor,Capitalizt,Superb,Frightening,Excellent
nation=new_anaston,The Free Land of New Anaston,Capitalizt,Excellent,Frightening,Average
nation=jalasandria,The Corporate Republic of Jalasandria,Father Knows Best State,Below Average,Frightening,Rare
nation=smitopbot6,The Republic of SmitopBot6,Inoffensive Centrist Democracy,Below Average,Frightening,Some
nation=meghanada,The United Federation of Meghanada,Left-Leaning College State,Superb,Powerhouse,Excellent
nation=yin_and_yog,The Unfathonable Gateway of Yin and Yog,Father Knows Best State,Average,Very Strong,Few
nation=bobinson,The Rogue Nation of Bobinson,Iron Fist Consumerists,Some,Frightening,Rare
nation=lgbt_equality,The Safe Haven of LGBT Equality,New York Times Democracy,Excellent,Frightening,Superb
nation=conch_kingdom,The Sun Never Sets on the Empire of Conch Kingdom,Libertarian Police State,Superb,Frightening,Few
nation=congo,The Democratic Republic of Congo,Capitalist Paradise,Very Good,Frightening,Very Good
nation=produits_artistiques_metaux_precieux,The Secret Refinery of Produits Artistiques Metaux Precieux,Mother Knows Best State,Some,Frightening,Rare
nation=hellfire_facilitators,The Holy Empire of Hellfire Facilitators,Corporate Police State,Some,Strong,Outlawed
nation=unparalleled_lunacy,The All-Circumspect Confederacy of Unparalleled Lunacy,Capitalizt,Superb,Frightening,Very Good
nation=jasque,The Radioactive Republic of Jasque,Civil Rights Lovefest,World Benchmark,Frightening,Superb
nation=suine,The Free Land of Suine,Anarchy,Superb,Good,Excessive
nation=al-najd,The Almamlakat alwihabia of Al-Najd,Corporate Police State,Some,Frightening,Rare
