Unique URL,Nation Name,WA Category,Civil Rights,Economy,Political Freedom
nation=east_borland,The Exalted Supremacy of East Borland,Iron Fist Consumerists,Unheard Of,Frightening,Unheard Of
nation=cutote,The People's Republic of Cutote,Corporate Police State,Unheard Of,Frightening,Unheard Of
nation=northern_borland,The Allied Corporate Empire of Northern Borland,Capitalizt,Superb,Frightening,Good
nation=little_flowers,The Empire of Little Flowers,Capitalizt,Excellent,Frightening,Below Average
nation=nak_nak,The Allmighty Power of Nak nak,Compulsory Consumerist State,Below Average,Frightening,Unheard Of
nation=eretzisrael,The Walled Cities of EretzIsrael,Capitalist Paradise,Excellent,Frightening,Very Good
nation=cashdeer,The Libertarian Paradise of Cashdeer,Anarchy,Excessive,Frightening,World Benchmark
nation=the_iron_league,The Supreme Dictatorship of The Iron League,Corporate Police State,Outlawed,Frightening,Unheard Of
nation=lamebrainia,The Idiocracy of Lamebrainia,Capitalist Paradise,Some,Frightening,Good
nation=edgemaster,The Infection of Edgemaster,Compulsory Consumerist State,Very Good,Frightening,Few
nation=complete_bastards,The Dominion of Complete Bastards,Iron Fist Consumerists,Outlawed,Frightening,Outlawed
nation=nadir_dystopia,The Holy Yellow CAM of Nadir Dystopia,Iron Fist Consumerists,Unheard Of,Frightening,Unheard Of
nation=dragyn,The Iron Mall of Dragyn,Capitalizt,Superb,Frightening,Good
nation=midlands,The United States of Midlands,Anarchy,Superb,Frightening,Widely Abused
nation=king_carl,The Mysterious Airship of King Carl,Iron Fist Consumerists,Rare,Frightening,Rare
nation=chris_hall,The Free Land of Chris Hall,Iron Fist Consumerists,Outlawed,Frightening,Unheard Of
nation=muspellheim,The Brennanndi Ríki of Muspellheim,Corporate Police State,Rare,Frightening,Rare
nation=the_grendels,The Indomitable Borderlands of The Grendels,Compulsory Consumerist State,Some,Frightening,Unheard Of
nation=the_centauri,The Burlesque Republic of The Centauri,Compulsory Consumerist State,Very Good,Frightening,Few
nation=the_strategic_air_command,The United Stratocratic States of The Strategic Air Command,Iron Fist Consumerists,Outlawed,Frightening,Unheard Of
nation=ewing_oil_co,The Barnes-Free Conglomerate of Ewing Oil Co,Corporate Police State,Few,Frightening,Few
nation=daedra1a,The Modern Portfolio Theory of Daedra1a,Capitalist Paradise,Very Good,Frightening,Excellent
nation=overdosed_crackheads,The Dictatorship of Overdosed crackheads,Iron Fist Consumerists,Outlawed,Frightening,Unheard Of
nation=techno,The Allmighty Nak Nakian Colony of Techno,Corporate Police State,Rare,Frightening,Unheard Of
nation=the_goggles,The Confederacy of The Goggles,Iron Fist Consumerists,Few,Frightening,Outlawed
nation=isla_vista,The Godless Mercantile Nexus of Isla Vista,Compulsory Consumerist State,Average,Frightening,Few
nation=brotherhood_of_nod,The Dictatorship of Brotherhood of nod,Corporate Police State,Few,Frightening,Unheard Of
nation=feckface,The Allmighty Nak Nakian Colony of Feckface,Corporate Police State,Unheard Of,Frightening,Unheard Of
nation=koffee,The Richly Blended Peoples of Koffee,Capitalist Paradise,Average,Frightening,Average
nation=the_knight_who_says_ni,The Allmighty Nak Nakian Colony of The knight who says NI,Compulsory Consumerist State,Good,Frightening,Rare
nation=rindiania,The Rogue Nation of Rindiania,Corporate Police State,Rare,Frightening,Unheard Of
nation=knowwear_in_youtopia,The Armed Republic of Knowwear in Youtopia,Iron Fist Consumerists,Unheard Of,Frightening,Unheard Of
nation=trixmonia,The Ironwill Dictatorship of Trixmonia,Father Knows Best State,Some,Frightening,Unheard Of
nation=wulfhelm,The Soul-Crushing Factories of Wulfhelm,Corporate Police State,Few,Frightening,Unheard Of
nation=bright_angel,The Sadistic Republic of Bright Angel,Iron Fist Consumerists,Outlawed,Frightening,Unheard Of
nation=haedlia,The Holy Empire of Haedlia,Iron Fist Consumerists,Unheard Of,Frightening,Unheard Of
nation=zaktoutr,The Reformed Demonic Assembly of Zaktoutr,Corporate Police State,Outlawed,Frightening,Unheard Of
nation=pterodoria,The PS2 Puppet of Pterodoria,Capitalist Paradise,Very Good,Frightening,Some
nation=the_dark_system,The Mafian Economic Extremist of The Dark System,Compulsory Consumerist State,Below Average,Frightening,Rare
nation=tremalkier,The Insatiable Economic Hitmen of Tremalkier,Capitalizt,Excellent,Frightening,Average
nation=santa_is_satan,The Evil Empire of Santa Is Satan,Compulsory Consumerist State,Below Average,Frightening,Rare
nation=aurora_islands,The Armed Corporations of Aurora Islands,Capitalist Paradise,Very Good,Frightening,Very Good
nation=fudgedup,The Hellhole of Fudgedup,Corporate Police State,Some,Frightening,Few
nation=euraustralasamerica,The Post-Communist Kleptocracy of Euraustralasamerica,Corporate Police State,Outlawed,Frightening,Unheard Of
nation=hc_eredivisie,The Thirteen Zombie Hells of HC Eredivisie,Iron Fist Consumerists,Few,Frightening,Few
nation=mackintosh,The Grotesque Playground of Mackintosh,Compulsory Consumerist State,Below Average,Frightening,Unheard Of
nation=papadracky,The Galactic Trade Conglomerate of PapaDracky,Anarchy,World Benchmark,Frightening,Excellent
nation=darkmen,The Kingdom of Darkmen,Corporate Police State,Unheard Of,Frightening,Unheard Of
nation=corfad,The Dictatorship of Corfad,Corporate Police State,Unheard Of,Frightening,Unheard Of
nation=zurkerx,The Constitutional Empire of Zurkerx,Anarchy,Excessive,Frightening,Excellent
nation=look_at_me,The Zombie Nukers of Look at me,Corporate Police State,Unheard Of,Frightening,Unheard Of
nation=veremur,The Empire of Veremur,Iron Fist Consumerists,Outlawed,Frightening,Unheard Of
nation=valkalan,The Directorate of Valkalan,Capitalist Paradise,Average,Frightening,Below Average
nation=menta_lee-il,The Letterman Commie Paradise of Menta Lee-IL,Iron Fist Consumerists,Outlawed,Strong,Unheard Of
nation=cassaria,The Free Society of Cassaria,Anarchy,Frightening,Frightening,Widely Abused
nation=nakina_koreazu,The Mad Empire of Nakina Koreazu,Iron Fist Consumerists,Rare,Frightening,Rare
nation=hesperonis,The Ur-Quan Masters of Hesperonis,Compulsory Consumerist State,Very Good,Frightening,Few
nation=anemone_reef,The Corporatocracy of Anemone Reef,Anarchy,Superb,Frightening,Superb
nation=teufelvolk,The Dominion of Teufelvolk,Civil Rights Lovefest,World Benchmark,Frightening,Superb
nation=the_captain,The Dominion of The Captain,Corporate Police State,Some,Frightening,Rare
nation=the_happy_civilians,The Free and Holy Republic of The Happy Civilians,Corporate Police State,Unheard Of,Frightening,Unheard Of
nation=totoso_mussolini,The CIDAO of Totoso_Mussolini,Capitalist Paradise,Average,Frightening,Very Good
nation=alien_magic,The Rogue Nation of Alien Magic,Corporate Police State,Unheard Of,Frightening,Unheard Of
nation=sheeptopia,The Grand Overkingdom of Sheeptopia,Corporate Police State,Unheard Of,Frightening,Unheard Of
nation=abu_ammar,The Holiest Flavor of ABU AMMAR,Father Knows Best State,Some,Frightening,Unheard Of
nation=wars_forever,The United States of Wars Forever,Iron Fist Consumerists,Unheard Of,Frightening,Rare
nation=iznogoud,The Caliphate of Iznogoud,Corporate Police State,Some,Frightening,Rare
nation=achaian_peloponnese,The Isaurian League of Achaian Peloponnese,Compulsory Consumerist State,Very Good,Frightening,Rare
nation=psypheria,The Liberated Cartel of Psypheria,Capitalizt,Excellent,Frightening,Good
nation=vosiycrs,The Dominion of Vosiycrs,Anarchy,Excessive,Frightening,Widely Abused
nation=pseudomonarchy_demonum,The Dominatus Malefici of Pseudomonarchy Demonum,Iron Fist Consumerists,Unheard Of,Frightening,Outlawed
nation=lord_dominator,The Burning Trash Fire of Lord Dominator,Corporate Police State,Few,Frightening,Unheard Of
nation=the_paradimensional_ascendancy,The Enlightened Empire of The Paradimensional Ascendancy,Capitalist Paradise,Excellent,Frightening,Excellent
nation=boloshniya,The United Economic Republic of Boloshniya,Iron Fist Consumerists,Unheard Of,Frightening,Unheard Of
nation=flarbinia,The Galactic Empire of Flarbinia,Iron Fist Consumerists,Some,Frightening,Unheard Of
nation=the_glorious_empire,The Harkonnen Dominions of The Glorious Empire,Iron Fist Consumerists,Outlawed,Frightening,Outlawed
nation=le_duche,The Grand Duchy Duchy Dutch of Le Duche,Compulsory Consumerist State,Some,Frightening,Unheard Of
nation=the_zocalo,The Sexy Spacefaring Shogunate of The Zocalo,Capitalist Paradise,Good,Frightening,Average
nation=anathema_armaments,The Creaking Casino Floors of Anathema Armaments,Corporate Bordello,Very Good,Frightening,Excellent
nation=nothreen,The Borderlands of Nothreen,Anarchy,Frightening,Frightening,Corrupted
nation=valrknut,The Clad in Gold Republic of Valrknut,Capitalist Paradise,Excellent,Frightening,Very Good
nation=geodesicdragon,The Apocalypse of GeodesicDragon,Iron Fist Consumerists,Unheard Of,Frightening,Unheard Of
nation=the_colonial_fleet,The Dysfunctional Viper Pilots of The Colonial Fleet,Capitalist Paradise,Very Good,Frightening,Some
nation=clutch2,The Hellish Realm of Clutch2,Iron Fist Consumerists,Unheard Of,Frightening,Unheard Of
nation=brenner_islandia,The United States of Brenner Islandia,Capitalizt,Superb,Frightening,Excellent
nation=de_hork,The Lil'Lebowski Urban Achievers of De HoRK,Corporate Police State,Unheard Of,Frightening,Unheard Of
nation=riksland,The Polluted Glowing Wasteland of Riksland,Corporate Police State,Unheard Of,Frightening,Unheard Of
nation=anticountriopia,The Liberty Paradise of Anticountriopia,Corporate Police State,Unheard Of,Frightening,Rare
nation=matofali,The Megalopolis Corporatocracy of Matofali,Compulsory Consumerist State,Good,Frightening,Few
nation=myrth,The NPO High Inquisitor of Myrth,Compulsory Consumerist State,Very Good,Frightening,Few
nation=kabayong_malibog,The Holy Green Hotspots of Kabayong Malibog,Anarchy,World Benchmark,Frightening,Widely Abused
nation=dyzistrolux,The Corporate Imperium of Dyzistrolux,Anarchy,Superb,Frightening,Excellent
nation=marnady,The Zombie Corrupt Evil Corp of Marnady,Psychotic Dictatorship,Outlawed,Frightening,Unheard Of
nation=greater_somewhere,The Dominion of Greater Somewhere,Corporate Police State,Few,Frightening,Unheard Of
nation=momstononistan,The Rogue Nation of Momstononistan,Compulsory Consumerist State,Some,Frightening,Outlawed
nation=askatopia,The PS2 Puppet of Askatopia,Psychotic Dictatorship,Unheard Of,Frightening,Unheard Of
nation=anaxphonia,The Armed Republic of Anaxphonia,Anarchy,Superb,Frightening,Superb
nation=seven_by_nine,The Dominion of Seven by Nine,Iron Fist Consumerists,Outlawed,Frightening,Outlawed
nation=the_objectivist_commonwealth,The Free Land of The Objectivist Commonwealth,Anarchy,Superb,Frightening,Widely Abused
nation=zerentopia,The Plutocratic Banana Republic of Zerentopia,Corporate Police State,Few,Frightening,Rare
nation=steveoville,The Police State of Steveoville,Corporate Police State,Unheard Of,Frightening,Unheard Of
nation=pallidonia,The PS2 Puppet of Pallidonia,Anarchy,Frightening,Frightening,Corrupted
nation=miratejo,The Republic of Miratejo,Compulsory Consumerist State,Very Good,Frightening,Rare
nation=radiatia,The Federation of Radiatia,Capitalizt,Excellent,Frightening,Very Good
nation=monianoli,The Commonwealth of Monianoli,Capitalist Paradise,Average,Frightening,Average
nation=child_care_workers,The Nasty Side of Child Care Workers,Iron Fist Consumerists,Unheard Of,Frightening,Rare
nation=langersland,The Free State of Langersland,Iron Fist Consumerists,Outlawed,Frightening,Rare
nation=candlewhisper_archive,The AI See You of Candlewhisper Archive,Anarchy,World Benchmark,Frightening,Superb
nation=god_fearing_devoted,The Theocracy of God Fearing Devoted,Corporate Police State,Outlawed,Frightening,Unheard Of
nation=free_transhumanists,The Interstellar Coalition of Free Transhumanists,Capitalizt,Excellent,Frightening,Excellent
nation=artoonia,The Artoonian Empire of Artoonia,Anarchy,Excessive,Frightening,Widely Abused
nation=tenkistan,The Holy Empire of Tenkistan,Anarchy,Frightening,Frightening,Corrupted
nation=ervarean_republic,The Failed States of Ervarëa not of ErVaReAn rEpUbLiC,Anarchy,Frightening,Frightening,Corrupted
nation=donkervader,The Slow Loud Breathers of Donkervader,Iron Fist Consumerists,Unheard Of,Frightening,Rare
nation=terdiatlans,The Supreme High Imperium of Terdiatlans,Anarchy,Excellent,Frightening,Superb
nation=paradise,The Caliphate of Paradise,Corporate Police State,Unheard Of,Frightening,Outlawed
nation=unthank,The Murabian Protectorate of Unthank,Capitalist Paradise,Average,Frightening,Below Average
nation=geckocidron,The Necropolis Tyranny of Geckocidron,Iron Fist Consumerists,Few,Frightening,Unheard Of
nation=the_blessed_and_holy_land,The Holy Matriarchy of The Blessed and Holy Land,Corporate Police State,Unheard Of,Frightening,Unheard Of
nation=ferret_civilization,The Coadunate Member State of Ferret Civilization,Anarchy,Frightening,Frightening,Corrupted
nation=americad,The Unassuming Puppet State of Americad,Iron Fist Consumerists,Unheard Of,Frightening,Outlawed
nation=sehlysdre,The Incorporated States of Sehlysdre,Anarchy,World Benchmark,Frightening,Excessive
nation=exxosia,The Imperial Provinces of Exxosia,Capitalizt,Superb,Frightening,Below Average
nation=grave_raven,The Oppressed Peoples of Grave Raven,Capitalist Paradise,Average,Frightening,Below Average
nation=the_real_matrix,The Little Brotherhood of The Real Matrix,Iron Fist Consumerists,Rare,Frightening,Outlawed
nation=shark-istan,The Imperial State of Shark-istan,Corporate Police State,Unheard Of,Frightening,Unheard Of
nation=the_rouge_christmas_state,The Dixieland Empire of The Rouge Christmas State,Corporate Bordello,Excellent,Frightening,Superb
nation=american_orion,The Greater Republic of American Orion,Psychotic Dictatorship,Outlawed,Frightening,Unheard Of
nation=warson,The Juggernaught War State of Warson,Compulsory Consumerist State,Below Average,Frightening,Rare
nation=klesh,The Holy Empire of Klesh,Iron Fist Consumerists,Outlawed,Frightening,Unheard Of
nation=halbhalbha,The Confederacy of Halbhalbha,Anarchy,Excellent,Frightening,Superb
nation=gray_mouser,The Decadent Opulence of Gray Mouser,Capitalizt,Excessive,Frightening,Very Good
nation=eternal_dam_nation,The Christmas Planes of Eternal Dam Nation,Anarchy,Superb,Frightening,Corrupted
nation=9003,The Nation formally by the name of 9003,Father Knows Best State,Good,Frightening,Unheard Of
nation=dungeon,The Black Iron Prison State of Dungeon,Corporate Police State,Unheard Of,Frightening,Unheard Of
nation=the_souless_damned,The Grim Wastelands of The Souless Damned,Father Knows Best State,Some,Frightening,Unheard Of
nation=krematoria,The All-Powerful Rogue Nation of Krematoria,Father Knows Best State,Below Average,Frightening,Rare
nation=clench,The Popsicle Pete Nation of Clench,Iron Fist Consumerists,Outlawed,Frightening,Outlawed
nation=kohrar,The Seafood Paradise of KohrAr,Compulsory Consumerist State,Average,Frightening,Rare
nation=restorza,The Holy Corporate Lottocracy of Restorza,Corporate Police State,Unheard Of,Frightening,Unheard Of
nation=israeli_airstrikes,The Oppressive Oppressors of Israeli Airstrikes,Corporate Police State,Unheard Of,Frightening,Outlawed
nation=economic_invincibility,The ELF-Eladen Exchange Entrepôt of Economic Invincibility,Capitalist Paradise,Excellent,Frightening,Average
nation=inquista,The Most Blessed State of Inquista,Anarchy,World Benchmark,Frightening,World Benchmark
nation=western_santos,The Republic of Western Santos,Anarchy,Excessive,Frightening,Excessive
nation=gallade,The Méritocratique Qui Marchande of Gallade,Anarchy,Excessive,Frightening,Widely Abused
nation=newtexas,The Big Tex Happy Taco Stands of NewTexas,Civil Rights Lovefest,World Benchmark,Frightening,Excessive
nation=gehenna_tartarus,The Empire of Gehenna Tartarus,Corporate Police State,Few,Powerhouse,Unheard Of
nation=widgetalia,The Trade Congolomorate of Widgetalia,Corporate Police State,Few,Frightening,Rare
nation=incindia_village,The Dictatorship of Incindia Village,Psychotic Dictatorship,Unheard Of,Frightening,Outlawed
nation=tzuland,The Military Dictatorship of Tzuland,Psychotic Dictatorship,Unheard Of,Frightening,Unheard Of
nation=the_new_chinese_states,The Genetic Realm of The New Chinese States,Capitalist Paradise,Good,Frightening,Average
nation=zombie_penguins,The Impending Doom of Zombie Penguins,Capitalizt,Frightening,Frightening,Very Good
nation=josephland,The Corporate Dictatorship of Josephland,Iron Fist Consumerists,Outlawed,Frightening,Outlawed
nation=win_mints,The Combined Corporations of Win Mints,Anarchy,Frightening,Frightening,Widely Abused
nation=vaktaria,The Unified Territories of Vaktaria,Compulsory Consumerist State,Below Average,Frightening,Unheard Of
nation=corporoat,The United Conglomerates of Corporoat,Anarchy,Excessive,Frightening,Widely Abused
nation=bai_lung,The Republic of Bai Lung,Iron Fist Consumerists,Few,Frightening,Rare
nation=keyser_soze,The Huddled Terrified Masses of Keyser Soze,Capitalizt,Excellent,Frightening,Average
nation=gruenberg,The Goat-Enabled Plutocracy of Gruenberg,Compulsory Consumerist State,Below Average,Frightening,Few
nation=savage_frontier,The Wasteland of Savage Frontier,Left-Leaning College State,Superb,Frightening,Very Good
nation=darthstassen,The Infinite Empire of DarthStassen,Father Knows Best State,Average,Frightening,Rare
nation=the_commonwealth_of_aus,The Rogue Nation of The Commonwealth of Aus,Inoffensive Centrist Democracy,Good,Frightening,Below Average
nation=corporate_investors,The Intergalactic Consortium of Corporate Investors,Anarchy,Superb,Frightening,Excellent
nation=pencil_sharpeners_2,The Panda of Pencil Sharpeners 2,Compulsory Consumerist State,Average,Frightening,Rare
nation=besot_bucolic_of_brawn,The Zombiefied Animal Farm of Besot Bucolic of Brawn,Iron Fist Consumerists,Outlawed,Frightening,Rare
nation=candain,The Mechanized Dominion of Candain,Capitalist Paradise,Good,Frightening,Good
nation=miraclia,The Miraculous Miracle of Miraclia,Corporate Police State,Unheard Of,Frightening,Unheard Of
nation=sprinkler,The Armed Republic of Sprinkler,Corporate Police State,Few,Frightening,Rare
nation=burning_pants,The Glorious Empire of Burning Pants,Anarchy,Frightening,Frightening,Corrupted
nation=andaricus,The Constitutional Republic of Andaricus,Anarchy,Frightening,Frightening,Excessive
nation=dementistan,The Unstable State of Dementistan,Father Knows Best State,Below Average,Frightening,Few
nation=walter_heisenberg,The Dictatorship of Walter Heisenberg,Corporate Police State,Rare,Frightening,Rare
nation=the_fyre_phoenix,The Rising Sun of The Fyre Phoenix,Anarchy,World Benchmark,Frightening,Superb
nation=sedgistan,The Oh My GOD! What were they thinking! He's a MODERATOR! of Sedgistan,Anarchy,Frightening,Imploded,Widely Abused
nation=iansisle,The Gull Flag Republic of Iansisle,Left-Leaning College State,Superb,Frightening,Below Average
nation=molson_iceland,The Zombie Dominion of Molson Iceland,Father Knows Best State,Good,Frightening,Rare
nation=hun_land,The Hunnic Empire of Hun Land,Corporate Police State,Unheard Of,Frightening,Unheard Of
nation=white_amazons,The Devastations of White Amazons,Corporate Police State,Unheard Of,Frightening,Outlawed
nation=owoistan,The Former UwU's republic of OwOistan,Compulsory Consumerist State,Very Good,Frightening,Few
nation=gorvania,The Federation of Gorvania,Capitalist Paradise,Some,Frightening,Below Average
nation=annihitor_the_incred,The Abominable Dreadstomp of Annihitor the Incred,Psychotic Dictatorship,Unheard Of,Frightening,Outlawed
nation=the_ascendant_hive,The Social Darwinist Imperium of The Ascendant Hive,Iron Fist Consumerists,Unheard Of,Frightening,Rare
nation=cdland,The Republic of CDland,Anarchy,Superb,Frightening,Excessive
nation=repressing_fools,The Borderlands of Repressing fools,Iron Fist Consumerists,Unheard Of,Frightening,Unheard Of
nation=the_country_without_a_name,The Rogue Nation of The Country Without a Name,Corporate Police State,Unheard Of,Frightening,Rare
nation=rightwingconservatives,The CUP Federal Syndicrats of RightWingConservatives,Free-Market Paradise,Few,Frightening,Excessive
nation=trouble_nation,The Dominion of Trouble Nation,Inoffensive Centrist Democracy,Good,Frightening,Very Good
nation=mechyrdia,The Star Empire of Mechyrdia,Corporate Bordello,Good,Frightening,Superb
nation=the_police_state,The Federation of The police state,Iron Fist Consumerists,Few,Frightening,Rare
nation=bretton,The Armed Fortress State of Bretton,Capitalist Paradise,Good,Frightening,Some
nation=admiral_janeway,The Federal States of Admiral Janeway,Compulsory Consumerist State,Good,Frightening,Few
nation=purdunamis,The Eigenstate of PurDunamis,Benevolent Dictatorship,Superb,Frightening,Few
nation=imperium_of_prussia,The Kingdom of Imperium of Prussia,Iron Fist Consumerists,Outlawed,Frightening,Outlawed
nation=omigodtheykilledkenny,The Mysterion Rising of Omigodtheykilledkenny,Capitalizt,Superb,Frightening,Excellent
nation=uelvan,The Migratory Fleets of Uelvan,Inoffensive Centrist Democracy,Good,Frightening,Some
nation=newer_gehenna,The Perfect Nation of Newer Gehenna,Iron Fist Consumerists,Outlawed,Frightening,Unheard Of
nation=elwher,The Confederacy of Elwher,Capitalizt,Superb,Frightening,Very Good
nation=the_vistoran_interstellar_trade_alliance,The Profitable Plutocracy of The Vistoran InterStellar Trade Alliance,Benevolent Dictatorship,Excessive,Frightening,Rare
nation=rands_objectivity,The Very Masculine Nation of Rands Objectivity,Capitalizt,Superb,Frightening,Excellent
nation=anarchocapitalistan,The Snow Crash Dystopia of Anarchocapitalistan,Capitalizt,Superb,Frightening,Excellent
nation=flibblers,The Morally Questionable People of Flibblers,Psychotic Dictatorship,Rare,Fair,Unheard Of
nation=latamer,The Latamer of Latamer,Corporate Police State,Unheard Of,Frightening,Unheard Of
nation=hollip,The Parent Company of Hollip,Capitalizt,Excellent,Frightening,Excellent
nation=petzconfederation,The Multiversal Empire of PetzConfederation,Father Knows Best State,Some,Frightening,Outlawed
nation=ironfistan,The Oppressed Peoples of Ironfistan,Compulsory Consumerist State,Average,Frightening,Rare
nation=zetox,The Empire of Zetox,Corporate Police State,Unheard Of,Frightening,Few
nation=lucy_cavendish,The Heavenly Light of Salvation of Lucy Cavendish,Anarchy,Frightening,Frightening,Excessive
nation=mdrunie,The Dictatorship of MDRunie,Inoffensive Centrist Democracy,Excellent,Frightening,Some
nation=adaia,The Salacious Exploits of Adaia,Corporate Police State,Few,Frightening,Unheard Of
nation=corruptionz,The Corrupted Corruption of Corruptionz,Anarchy,Frightening,Frightening,Corrupted
nation=ordenza,The Most Catholic City of Ordenza,Capitalist Paradise,Some,Frightening,Few
nation=teutionia,The Sovereign Covenant of Teutionia,Inoffensive Centrist Democracy,Very Good,Frightening,Few
nation=west_mattasia,The Unincorporated Community of West Mattasia,Anarchy,Frightening,Frightening,Excessive
nation=borman_empire,The War Machine of Borman Empire,Compulsory Consumerist State,Excellent,Frightening,Rare
nation=the_comedian,The Bitter and Disturbed Irony of The Comedian,Compulsory Consumerist State,Excellent,Frightening,Rare
nation=argorial,The Federation of Argorial,Compulsory Consumerist State,Some,Frightening,Rare
nation=nicorian,The Kingdom of Nicorian,Iron Fist Consumerists,Outlawed,Frightening,Unheard Of
nation=tornado_queendom,The Nazbol Queendom of Tornado Queendom,Mother Knows Best State,Some,Frightening,Unheard Of
nation=noahs_second_country,The Second Best of Noahs Second Country,Anarchy,World Benchmark,Frightening,Corrupted
nation=pale_mountains_of_klesh,The Bandit Kings of Pale Mountains of Klesh,Anarchy,Superb,Frightening,Superb
nation=onderkelkia,The Empire of Onderkelkia,Corporate Police State,Outlawed,Frightening,Unheard Of
nation=electronicarts,The Profiteering Corporations of ElectronicArts,Inoffensive Centrist Democracy,Excellent,Frightening,Below Average
nation=new_mitakihara,The Eternal Empire of New Mitakihara,Mother Knows Best State,Below Average,Frightening,Outlawed
nation=postapocalyptic_terror,The Corporate Dictatorship of Postapocalyptic Terror,Corporate Police State,Some,Frightening,Outlawed
nation=haven_of_wealth,The Corporate Conglomerate of Haven of wealth,Capitalizt,Superb,Frightening,Good
nation=violan,The Voluntarist Lands of Violan,Anarchy,World Benchmark,Frightening,Widely Abused
nation=suzi_island,The Free Republic of Suzi Island,Anarchy,Excessive,Frightening,Excellent
nation=heierlark,The Borderlands of Heierlark,Compulsory Consumerist State,Some,Frightening,Rare
nation=fafhrd,The Barbaric Magnificence of Fafhrd,Compulsory Consumerist State,Very Good,Frightening,Few
nation=zamberdaf,The Wealthy Evil Empire of Zamberdaf,Iron Fist Consumerists,Outlawed,Frightening,Unheard Of
nation=zero-one,The Queendom of Zero-One,Capitalizt,Superb,Frightening,Some
nation=woollevia,The Academic Dominion of Woollevia,Iron Fist Consumerists,Outlawed,Frightening,Outlawed
nation=moderium,The Federical Federations of Moderium,Corrupt Dictatorship,Good,Frightening,Few
nation=chavante,The Republic of Chavante,Anarchy,Superb,Frightening,Excessive
nation=west_hempstead,The Free Market Republic of West Hempstead,Capitalist Paradise,Very Good,Frightening,Average
nation=the_merry_christmas,The Corporate Theocracy of The Merry Christmas,Corporate Police State,Some,Frightening,Rare
nation=obvious_extra_vote,The Corporate Divisions of Obvious Extra Vote,Corporate Police State,Rare,Frightening,Rare
nation=klaus_devestatorie,The Avengrynkhal Ascendant of Klaus Devestatorie,Compulsory Consumerist State,Good,Frightening,Rare
nation=megatokyo-3,The Republic of MegaTokyo-3,Inoffensive Centrist Democracy,Excellent,Frightening,Average
nation=particle,The Interdimensional Domain of Particle,Father Knows Best State,Good,Frightening,Rare
