Unique URL,Nation Name,WA Category,Civil Rights,Economy,Political Freedom
nation=bright_angel,The Sadistic Republic of Bright Angel,Iron Fist Consumerists,Outlawed,Frightening,Unheard Of
nation=clench,The Popsicle Pete Nation of Clench,Iron Fist Consumerists,Outlawed,Frightening,Outlawed
nation=josephland,The Corporate Dictatorship of Josephland,Iron Fist Consumerists,Outlawed,Frightening,Outlawed
nation=the_real_matrix,The Little Brotherhood of The Real Matrix,Iron Fist Consumerists,Rare,Frightening,Outlawed
nation=americad,The Unassuming Puppet State of Americad,Iron Fist Consumerists,Unheard Of,Frightening,Outlawed
nation=hc_eredivisie,The Thirteen Zombie Hells of HC Eredivisie,Iron Fist Consumerists,Few,Frightening,Few
nation=despoticania,The Despotic Dictatorship of Despoticania,Psychotic Dictatorship,Few,Frightening,Outlawed
nation=nak_nak,The Allmighty Power of Nak nak,Compulsory Consumerist State,Below Average,Frightening,Unheard Of
nation=teufelvolk,The Dominion of Teufelvolk,Civil Rights Lovefest,World Benchmark,Frightening,Superb
nation=daedra1a,The Modern Portfolio Theory of Daedra1a,Capitalist Paradise,Very Good,Frightening,Excellent
nation=israeli_airstrikes,The Oppressive Oppressors of Israeli Airstrikes,Corporate Police State,Unheard Of,Frightening,Outlawed
nation=muspellheim,The Brennanndi Ríki of Muspellheim,Corporate Police State,Rare,Frightening,Rare
nation=askatopia,The PS2 Puppet of Askatopia,Psychotic Dictatorship,Outlawed,Frightening,Unheard Of
nation=northern_borland,The Allied Corporate Empire of Northern Borland,Capitalizt,Superb,Frightening,Good
nation=los_santos,The Very Large Safari Park of Los Santos,Iron Fist Consumerists,Unheard Of,Frightening,Unheard Of
nation=overdosed_crackheads,The Dictatorship of Overdosed crackheads,Iron Fist Consumerists,Outlawed,Frightening,Unheard Of
nation=koffee,The Richly Blended Peoples of Koffee,Capitalist Paradise,Average,Frightening,Average
nation=bistrostan,The Empire of Bistrostan,Inoffensive Centrist Democracy,Very Good,Frightening,Average
nation=the_grendels,The Indomitable Borderlands of The Grendels,Compulsory Consumerist State,Some,Frightening,Unheard Of
nation=blazing_samaritan,The It of Blazing Samaritan,Inoffensive Centrist Democracy,Some,Frightening,Some
nation=haedlia,The Holy Empire of Haedlia,Iron Fist Consumerists,Unheard Of,Frightening,Unheard Of
nation=feckface,The Allmighty Nak Nakian Colony of Feckface,Corporate Police State,Unheard Of,Frightening,Unheard Of
nation=isla_vista,The Godless Mercantile Nexus of Isla Vista,Compulsory Consumerist State,Average,Frightening,Few
nation=little_flowers,The Empire of Little Flowers,Capitalizt,Excellent,Frightening,Below Average
nation=abu_ammar,The Holiest Flavor of ABU AMMAR,Father Knows Best State,Some,Frightening,Unheard Of
nation=treadwellia,The Obesotocracy of Treadwellia,Iron Fist Consumerists,Unheard Of,Frightening,Rare
nation=east_borland,The Exalted Supremacy of East Borland,Iron Fist Consumerists,Unheard Of,Frightening,Unheard Of
nation=donkervader,The Slow Loud Breathers of Donkervader,Iron Fist Consumerists,Unheard Of,Frightening,Rare
nation=the_dark_system,The Mafian Economic Extremist of The Dark System,Compulsory Consumerist State,Below Average,Frightening,Rare
nation=nadir_dystopia,The Holy Yellow CAM of Nadir Dystopia,Iron Fist Consumerists,Unheard Of,Frightening,Unheard Of
nation=the_centauri,The Burlesque Republic of The Centauri,Compulsory Consumerist State,Very Good,Frightening,Few
nation=ewing_oil_co,The Barnes-Free Conglomerate of Ewing Oil Co,Corporate Police State,Few,Frightening,Few
nation=complete_bastards,The Dominion of Complete Bastards,Iron Fist Consumerists,Outlawed,Frightening,Outlawed
nation=euraustralasamerica,The Post-Communist Kleptocracy of Euraustralasamerica,Corporate Police State,Outlawed,Frightening,Unheard Of
nation=the_knight_who_says_ni,The Allmighty Nak Nakian Colony of The knight who says NI,Compulsory Consumerist State,Good,Frightening,Rare
nation=wulfhelm,The Soul-Crushing Factories of Wulfhelm,Corporate Police State,Few,Frightening,Unheard Of
nation=aurora_islands,The Armed Corporations of Aurora Islands,Capitalist Paradise,Very Good,Frightening,Very Good
nation=eretzisrael,The Walled Cities of EretzIsrael,Capitalist Paradise,Excellent,Frightening,Very Good
nation=trixmonia,The Ironwill Dictatorship of Trixmonia,Father Knows Best State,Some,Frightening,Unheard Of
nation=le_duche,The Grand Duchy Duchy Dutch of Le Duche,Compulsory Consumerist State,Some,Frightening,Unheard Of
nation=gamefaqs_founder,The Community of GameFAQs Founder,Authoritarian Democracy,Few,Frightening,Some
nation=techno,The Allmighty Nak Nakian Colony of Techno,Corporate Police State,Rare,Frightening,Unheard Of
nation=slaytania,The Union of Soviet States of Slaytania,Psychotic Dictatorship,Few,Frightening,Rare
nation=the_stalker,The Mad King of Hell of The Stalker,Father Knows Best State,Below Average,Frightening,Few
nation=tzuland,The Military Dictatorship of Tzuland,Psychotic Dictatorship,Unheard Of,Frightening,Unheard Of
nation=dragyn,The Iron Mall of Dragyn,Capitalizt,Superb,Frightening,Good
nation=cutote,The People's Republic of Cutote,Corporate Police State,Unheard Of,Frightening,Unheard Of
nation=domestic_corporate_america,The Commonwealth of Domestic Corporate America,Psychotic Dictatorship,Outlawed,Frightening,Unheard Of
nation=avalnier,The Helpdesk of Avalnier,Iron Fist Consumerists,Rare,Frightening,Rare
nation=last_choicia,The Anomaly of Last Choicia,Psychotic Dictatorship,Few,Frightening,Few
nation=tremalkier,The Insatiable Economic Hitmen of Tremalkier,Capitalizt,Excellent,Frightening,Average
nation=servoth,The Integrated Machine Authority of Servoth,Democratic Socialists,Very Good,Frightening,Average
nation=united_great_korea,The Dictatorship of United great Korea,Psychotic Dictatorship,Outlawed,Frightening,Outlawed
nation=dragonic_overlords,The Rogue Nation of Dragonic Overlords,Psychotic Dictatorship,Few,Frightening,Unheard Of
nation=gary_gatewood,The United States of Gary Gatewood,Left-Leaning College State,Superb,Frightening,Good
nation=edgemaster,The Infection of Edgemaster,Compulsory Consumerist State,Very Good,Frightening,Few
nation=woollevia,The Academic Dominion of Woollevia,Iron Fist Consumerists,Outlawed,Frightening,Outlawed
nation=geodesicdragon,The Apocalypse of GeodesicDragon,Iron Fist Consumerists,Unheard Of,Frightening,Unheard Of
nation=max_empire,The Illuminated Autocracy of Max Empire,Father Knows Best State,Some,Frightening,Outlawed
nation=chronotopia,The Desolation Dominion of Chronotopia,Iron Fist Consumerists,Unheard Of,Frightening,Unheard Of
nation=seven_by_nine,The Dominion of Seven by Nine,Iron Fist Consumerists,Outlawed,Frightening,Outlawed
nation=the_souless_damned,The Grim Wastelands of The Souless Damned,Father Knows Best State,Some,Frightening,Unheard Of
nation=the_strategic_air_command,The United Stratocratic States of The Strategic Air Command,Iron Fist Consumerists,Outlawed,Frightening,Unheard Of
nation=myrth,The NPO High Inquisitor of Myrth,Compulsory Consumerist State,Very Good,Frightening,Few
nation=zaktoutr,The Reformed Demonic Assembly of Zaktoutr,Corporate Police State,Outlawed,Frightening,Unheard Of
nation=klesh,The Holy Empire of Klesh,Iron Fist Consumerists,Outlawed,Frightening,Unheard Of
nation=so88er,The Incorporated States of So88er,Inoffensive Centrist Democracy,Excellent,Frightening,Good
nation=corfad,The Dictatorship of Corfad,Corporate Police State,Unheard Of,Frightening,Unheard Of
nation=treznor,The Empire of Treznor,Democratic Socialists,Good,Frightening,Very Good
nation=lamebrainia,The Idiocracy of Lamebrainia,Capitalist Paradise,Some,Frightening,Good
nation=woonsocket,The Big Bull of Woonsocket,Inoffensive Centrist Democracy,Excellent,Frightening,Very Good
nation=megatokyo-3,The Republic of MegaTokyo-3,Inoffensive Centrist Democracy,Excellent,Frightening,Average
nation=moderium,The Federical Federations of Moderium,Corrupt Dictatorship,Good,Frightening,Few
nation=the_glorious_empire,The Harkonnen Dominions of The Glorious Empire,Iron Fist Consumerists,Outlawed,Frightening,Outlawed
nation=pseudomonarchy_demonum,The Dominatus Malefici of Pseudomonarchy Demonum,Iron Fist Consumerists,Unheard Of,Frightening,Outlawed
nation=mdrunie,The Dictatorship of MDRunie,Inoffensive Centrist Democracy,Excellent,Frightening,Some
nation=agorus,The Republic of Agorus,Inoffensive Centrist Democracy,Good,Frightening,Some
nation=wannabeya,The Republic of Wannabeya,Inoffensive Centrist Democracy,Average,Frightening,Average
nation=fudgedup,The Hellhole of Fudgedup,Corporate Police State,Some,Frightening,Few
nation=child_care_workers,The Nasty Side of Child Care Workers,Iron Fist Consumerists,Unheard Of,Frightening,Rare
nation=sheeptopia,The Grand Overkingdom of Sheeptopia,Corporate Police State,Unheard Of,Frightening,Unheard Of
nation=the_captain,The Dominion of The Captain,Corporate Police State,Some,Frightening,Rare
nation=miratejo,The Republic of Miratejo,Compulsory Consumerist State,Very Good,Frightening,Rare
nation=chiselarf,The Colony of Chiselarf,Father Knows Best State,Some,Frightening,Few
nation=the_zocalo,The Sexy Spacefaring Shogunate of The Zocalo,Capitalist Paradise,Good,Frightening,Average
nation=the_pact_of_terra,The Empire of The Pact of Terra,Inoffensive Centrist Democracy,Below Average,Frightening,Some
nation=undivulged_principles,The Confederacy of Undivulged Principles,Left-wing Utopia,Superb,Frightening,Excessive
nation=terrians,The Hell Hole of Terrians,Corporate Police State,Outlawed,Frightening,Outlawed
nation=santa_is_satan,The Evil Empire of Santa Is Satan,Compulsory Consumerist State,Below Average,Frightening,Rare
nation=iznogoud,The Caliphate of Iznogoud,Corporate Police State,Some,Frightening,Rare
nation=de_hork,The Lil'Lebowski Urban Achievers of De HoRK,Corporate Police State,Unheard Of,Frightening,Unheard Of
nation=clutch2,The Hellish Realm of Clutch2,Iron Fist Consumerists,Unheard Of,Frightening,Unheard Of
nation=kidderminster,The Marquessate of Kidderminster,Iron Fist Consumerists,Unheard Of,Frightening,Rare
nation=lordofsummer,The Dictatorship of Lordofsummer,Father Knows Best State,Below Average,Frightening,Rare
nation=look_at_me,The Zombie Nukers of Look at me,Corporate Police State,Unheard Of,Frightening,Unheard Of
nation=kampfgruppe_400,The Metal Empire of Kampfgruppe 400,Iron Fist Consumerists,Outlawed,Frightening,Outlawed
nation=veremur,The Empire of Veremur,Iron Fist Consumerists,Outlawed,Frightening,Unheard Of
nation=twente,The Archbishopric of Twente,Psychotic Dictatorship,Outlawed,Frightening,Rare
nation=gruenberg,The Goat-Enabled Plutocracy of Gruenberg,Compulsory Consumerist State,Below Average,Frightening,Few
nation=hobbitat,The Precious Taters of Hobbitat,Left-Leaning College State,Excellent,Frightening,Average
nation=new_owningland,The Imperatoria of New Owningland,Iron Fist Consumerists,Few,Frightening,Rare
nation=gaberel,The Empire of Gaberel,Iron Fist Consumerists,Unheard Of,Frightening,Rare
nation=miraclia,The Miraculous Miracle of Miraclia,Corporate Police State,Unheard Of,Frightening,Unheard Of
nation=frennierstan,The Republic of Frennierstan,Inoffensive Centrist Democracy,Excellent,Frightening,Very Good
nation=turtleshroom_ii,The Great Bountiful Empire of TURTLESHROOM II,Right-wing Utopia,Rare,Frightening,Very Good
nation=zurkerx,The Constitutional Empire of Zurkerx,Anarchy,Excessive,Frightening,Excellent
nation=pterodoria,The PS2 Puppet of Pterodoria,Capitalist Paradise,Very Good,Frightening,Some
nation=heyzay,The Federal Unitary Stratocracy of HeyZay,Father Knows Best State,Average,Frightening,Rare
nation=the_colonial_fleet,The Dysfunctional Viper Pilots of The Colonial Fleet,Capitalist Paradise,Very Good,Frightening,Some
nation=imperial_states_america,The Royal Empire of Imperial States America,Iron Fist Consumerists,Outlawed,Frightening,Unheard Of
nation=repressing_fools,The Borderlands of Repressing fools,Iron Fist Consumerists,Unheard Of,Frightening,Unheard Of
nation=paradise,The Caliphate of Paradise,Corporate Police State,Unheard Of,Frightening,Outlawed
nation=dementistan,The Unstable State of Dementistan,Father Knows Best State,Below Average,Frightening,Few
nation=illevium,The Eternal Empire of Illevium,Father Knows Best State,Excellent,All-Consuming,Unheard Of
nation=geckocidron,The Necropolis Tyranny of Geckocidron,Iron Fist Consumerists,Few,Frightening,Unheard Of
nation=ultimaweapon,The Holy Empire of UltimaWeapon,Mother Knows Best State,Below Average,Frightening,Rare
nation=the_police_state,The Federation of The police state,Iron Fist Consumerists,Few,Frightening,Rare
nation=nukls-andwicz,The Free Buffet of Nukls-Andwicz,Corporate Police State,Outlawed,Frightening,Unheard Of
nation=american_orion,The Greater Republic of American Orion,Psychotic Dictatorship,Outlawed,Frightening,Unheard Of
nation=russian_oil,The Empire of Russian Oil,Moralistic Democracy,Some,Frightening,Some
nation=iraqgreece,The Nazi one-party totalitarian of IraqGreece,Iron Fist Consumerists,Rare,Frightening,Rare
nation=gallade,The Méritocratique Qui Marchande of Gallade,Anarchy,Excessive,Frightening,Widely Abused
nation=the_big_bad_boo,The Cattery of The Big Bad Boo,Democratic Socialists,Very Good,Frightening,Very Good
nation=101110101000,The Cyber Technocracy of 101110101000,Corrupt Dictatorship,Some,Frightening,Rare
nation=epiaris22,The Republic of Epiaris22,Moralistic Democracy,Some,Frightening,Some
nation=harmonious_paperclips,The Incorporated Entity of Harmonious Paperclips,Iron Fist Consumerists,Few,Frightening,Unheard Of
nation=flanderlion,The Glorious Kingdom of Flanderlion,Psychotic Dictatorship,Outlawed,Frightening,Unheard Of
nation=firstaria,The Regno dell'Overlord of Firstaria,Corrupt Dictatorship,Some,Frightening,Unheard Of
nation=gorvania,The Federation of Gorvania,Capitalist Paradise,Some,Frightening,Below Average
nation=inquista,The Most Blessed State of Inquista,Anarchy,World Benchmark,Frightening,World Benchmark
nation=46566,The Grand Duchy of 46566,Corrupt Dictatorship,Some,Frightening,Rare
nation=geisler,The Confederacy of Geisler,Moralistic Democracy,Rare,Frightening,Some
nation=refugiado,The Mighty People of Refugiado,Inoffensive Centrist Democracy,Below Average,Frightening,Some
nation=the_happy_civilians,The Free and Holy Republic of The Happy Civilians,Corporate Police State,Unheard Of,Frightening,Unheard Of
nation=furq2,The Holy Empire of FurQ2,Inoffensive Centrist Democracy,Some,Frightening,Average
nation=otaku_stratus,The Athenian Paradise of Otaku Stratus,Civil Rights Lovefest,Superb,Frightening,Superb
nation=dragon_isles,The Empire of Dragon Isles,Father Knows Best State,Very Good,Frightening,Few
nation=slattsenw,The Federal States of Slattsenw,Iron Fist Consumerists,Few,Frightening,Rare
nation=smitopbot87,The Republic of SmitopBot87,Father Knows Best State,Average,Frightening,Rare
nation=hunck,The Imperium of Hunck,Father Knows Best State,Good,Frightening,Unheard Of
nation=zerentopia,The Plutocratic Banana Republic of Zerentopia,Corporate Police State,Few,Frightening,Rare
nation=multiple_bounty,The Revisionist Republic of Multiple Bounty,Democratic Socialists,Very Good,Frightening,Very Good
nation=westburn,The Principality of Westburn,Iron Fist Consumerists,Unheard Of,Frightening,Unheard Of
nation=cthonian_wasteland,The Architeuthis Dux of Cthonian Wasteland,Inoffensive Centrist Democracy,Excellent,Frightening,Below Average
nation=politiania,The Federation of Politiania,Father Knows Best State,Average,Frightening,Rare
nation=anaxphonia,The Armed Republic of Anaxphonia,Anarchy,Superb,Frightening,Superb
nation=sanshouo,The Rogue Nation of Sanshouo,Father Knows Best State,Some,Frightening,Few
nation=klaus_devestatorie,The Avengrynkhal Ascendant of Klaus Devestatorie,Compulsory Consumerist State,Good,Frightening,Rare
nation=mercobia,The Socialist Alliance of Mercobia,Liberal Democratic Socialists,Excellent,Frightening,Excellent
nation=prior_of_ori,The MASTER OF UNIVERSE of Prior Of Ori,Iron Fist Consumerists,Few,Frightening,Few
nation=arutiise,The Nuhaatyc Republic of Arutiise,Corrupt Dictatorship,Some,Frightening,Unheard Of
nation=mushet,The Restorative Republic of Mushet,Civil Rights Lovefest,Superb,Frightening,Excellent
nation=oslasa60,The Republic of Oslasa60,Father Knows Best State,Some,Frightening,Few
nation=psypheria,The Liberated Cartel of Psypheria,Capitalizt,Excellent,Frightening,Good
nation=singu1arity,The Scarlet Symphony of Singu1arity,Father Knows Best State,Average,Frightening,Rare
nation=pautain,The Associated States of Pautain,Corrupt Dictatorship,Very Good,Frightening,Few
nation=pencil_sharpeners_2,The Panda of Pencil Sharpeners 2,Compulsory Consumerist State,Average,Frightening,Rare
nation=kartoffelspan,The Holy Armed Empire of Kartoffelspan,Liberal Democratic Socialists,Excellent,Frightening,Excellent
nation=naive_schoolgirls,The Academia Tyrannica of Naive Schoolgirls,Psychotic Dictatorship,Outlawed,Frightening,Outlawed
nation=vocenae,The Imperial Star Republic of Vocenae,Compulsory Consumerist State,Some,Frightening,Unheard Of
nation=raul48,The Republic of Raul48,Father Knows Best State,Some,Frightening,Rare
nation=rightwingconservatives,The CUP Federal Syndicrats of RightWingConservatives,Free-Market Paradise,Few,Frightening,Excessive
nation=flarbinia,The Galactic Empire of Flarbinia,Iron Fist Consumerists,Some,Frightening,Unheard Of
nation=rindiania,The Rogue Nation of Rindiania,Corporate Police State,Rare,Frightening,Unheard Of
nation=doperland,The Holy Dictatorship of Doperland,Iron Fist Consumerists,Some,Frightening,Rare
nation=magisteria,The Magocracy of Magisteria,Iron Fist Consumerists,Outlawed,Frightening,Outlawed
nation=rallori,The Dystopian Corporate Republic of Rallori,Capitalist Paradise,Excellent,Frightening,Some
nation=raul11,The Republic of Raul11,Moralistic Democracy,Few,Frightening,Some
nation=random_one,The GV Corporal of Random One,Iron Fist Consumerists,Few,Frightening,Rare
nation=delberz,The Hegemony of Delberz,Iron Fist Consumerists,Few,Frightening,Outlawed
nation=shield_hq,The Battered Civil War Zone of SHIELD HQ,Corporate Police State,Outlawed,Frightening,Unheard Of
nation=oslasa26,The Republic of Oslasa26,Iron Fist Consumerists,Few,Frightening,Unheard Of
nation=yeno,The Divine Right Empire of Yeno,Iron Fist Consumerists,Outlawed,Frightening,Unheard Of
nation=jalliala,The Depressing Hellscape of Jalliala,Psychotic Dictatorship,Outlawed,Frightening,Outlawed
nation=sheoss,The Evil Armed Psychotic Empire of Sheoss,Iron Fist Consumerists,Some,Frightening,Rare
nation=eastie,The Colony of Eastie,Father Knows Best State,Some,Frightening,Unheard Of
nation=zero-one,The Queendom of Zero-One,Capitalizt,Superb,Frightening,Some
nation=momstononistan,The Rogue Nation of Momstononistan,Compulsory Consumerist State,Some,Frightening,Outlawed
nation=miiros,The Consortium of Miiros,Civil Rights Lovefest,World Benchmark,Frightening,Superb
nation=anticountriopia,The Liberty Paradise of Anticountriopia,Corporate Police State,Unheard Of,Frightening,Rare
nation=valkalan,The Directorate of Valkalan,Capitalist Paradise,Average,Frightening,Good
nation=nickel_empire,The Imperial Realm of Nickel Empire,Capitalist Paradise,Very Good,Frightening,Excellent
nation=the_american_fascist_republic,The Feminist Society of The American Fascist Republic,Psychotic Dictatorship,Few,Frightening,Outlawed
nation=sakkra,The Herpetological Empire of Sakkra,New York Times Democracy,Excellent,Frightening,Superb
nation=particle,The Interdimensional Domain of Particle,Father Knows Best State,Good,Frightening,Rare
nation=darussalam,The Eternal Phantasmagoria of Darussalam,Compulsory Consumerist State,Good,Frightening,Few
nation=kyroistan,The Armed Republic of Kyroistan,Iron Fist Consumerists,Few,Frightening,Rare
nation=widgetalia,The Trade Congolomorate of Widgetalia,Corporate Police State,Few,Frightening,Rare
nation=papadracky,The Galactic Trade Conglomerate of PapaDracky,Anarchy,World Benchmark,Frightening,Excellent
nation=reqovia,The Empire of Reqovia,Psychotic Dictatorship,Rare,Frightening,Rare
nation=new_mitakihara,The Eternal Empire of New Mitakihara,Mother Knows Best State,Below Average,Frightening,Outlawed
nation=the_transpecos,The Free State of The TransPecos,Father Knows Best State,Some,Frightening,Rare
nation=super_bowl_28,The Republic of Super Bowl 28,Iron Fist Consumerists,Some,Frightening,Rare
nation=totoso_mussolini,The CIDAO of Totoso_Mussolini,Capitalist Paradise,Average,Frightening,Very Good
nation=sulaymaan,The United Republics of Sulaymaan,Inoffensive Centrist Democracy,Good,Frightening,Excellent
nation=marnady,The Zombie Corrupt Evil Corp of Marnady,Psychotic Dictatorship,Outlawed,Frightening,Unheard Of
nation=dyzistrolux,The Corporate Imperium of Dyzistrolux,Anarchy,Superb,Frightening,Excellent
nation=istormia,The Possom Sanctuary of IStormia,Iron Fist Consumerists,Unheard Of,Frightening,Rare
nation=elwher,The Confederacy of Elwher,Capitalizt,Superb,Frightening,Very Good
nation=isbjorn_maerenne_bava_paerani,The Sick Beat of Isbjorn Maerenne Bava Paerani,Father Knows Best State,Some,Frightening,Rare
nation=pan_galacia,The Orbital Pleasure Palace of Pan Galacia,Iron Fist Consumerists,Unheard Of,Frightening,Outlawed
nation=expendia,The Monastic Technocracy of Expendia,Corrupt Dictatorship,Some,Frightening,Outlawed
nation=haishan,The Techno-Induscracy of Haishan,Father Knows Best State,Some,Frightening,Few
nation=kortik,The Federation of Kortik,Democratic Socialists,Below Average,Frightening,Good
nation=anathema_armaments,The Creaking Casino Floors of Anathema Armaments,Corporate Bordello,Very Good,Frightening,Excellent
nation=colonino,The Grand State of Colonino,Inoffensive Centrist Democracy,Very Good,Frightening,Good
nation=tzepam,The Corporate Imperium of Tzepam,Inoffensive Centrist Democracy,Below Average,Frightening,Below Average
nation=tropico_isla_de_hierro,The Republic of Tropico Isla de Hierro,Father Knows Best State,Some,Frightening,Rare
nation=szczuropolis,The Vermindom of Szczuropolis,Inoffensive Centrist Democracy,Excellent,Frightening,Very Good
nation=cruciland,The Fascist Legion of Cruciland,Psychotic Dictatorship,Unheard Of,Frightening,Outlawed
nation=lowsten,The Federation of Lowsten,Anarchy,Excellent,Frightening,Excellent
nation=epiaris27,The Republic of Epiaris27,Father Knows Best State,Some,Frightening,Outlawed
nation=gooutofhere,The Culture of Gooutofhere,Mother Knows Best State,Very Good,Frightening,Few
nation=the_country_without_a_name,The Rogue Nation of The Country Without a Name,Corporate Police State,Unheard Of,Frightening,Rare
nation=bepu,The BEPU of BEPU,Iron Fist Consumerists,Outlawed,Frightening,Outlawed
nation=cassaracen,The Federal Republic of Cassaracen,Corporate Police State,Few,Frightening,Rare
nation=testing_nation_448,The Republic of Testing Nation 448,Father Knows Best State,Below Average,Frightening,Rare
nation=midlands,The United States of Midlands,Anarchy,Superb,Frightening,Widely Abused
nation=rototornik,The Empire of Rototornik,Iron Fist Consumerists,Unheard Of,Frightening,Unheard Of
nation=the_omnicorp_group,The Corporate Republic of The OMNICORP Group,Father Knows Best State,Some,Frightening,Unheard Of
nation=spetre,The Holy and Absolute Darkness of Spetre,Iron Fist Consumerists,Outlawed,Frightening,Unheard Of
nation=trotsville,The Republic of Trotsville,Inoffensive Centrist Democracy,Below Average,Frightening,Few
nation=socialist_communist_states,The Not Kokichi of Socialist Communist States,Corporate Police State,Outlawed,Frightening,Outlawed
nation=kassaran,The Adynnic Federal Republic of Kassaran,Democratic Socialists,Average,Frightening,Below Average
nation=fake_communism1,The Republic of Fake Communism1,Iron Fist Consumerists,Few,Frightening,Outlawed
nation=urial57,The Republic of Urial57,Iron Fist Consumerists,Few,Frightening,Rare
nation=oslasa35,The Republic of Oslasa35,Iron Fist Consumerists,Few,Frightening,Few
nation=corrupted_countries,The Heavily Armed Empire of Corrupted Countries,Corporate Police State,Few,Frightening,Rare
nation=amber_port,The Most Serene Republic of Amber Port,Iron Fist Consumerists,Rare,Frightening,Unheard Of
nation=the_union_of_mandalorian_erebor,The Holy Solar Empire of The Union of Mandalorian Erebor,Corporate Police State,Unheard Of,Frightening,Outlawed
nation=bad_option,The Rogue Nation of Bad option,Psychotic Dictatorship,Unheard Of,Frightening,Rare
nation=mox_sapphire,The Mana Source of Mox Sapphire,Father Knows Best State,Some,Frightening,Unheard Of
nation=galactistan,The Holy Empire of Galactistan,Father Knows Best State,Some,Frightening,Few
nation=theranis_iii,The Empire of Theranis III,Psychotic Dictatorship,Few,Frightening,Outlawed
nation=estonul,The Sacred Kingdoms of Estonul,Father Knows Best State,Average,Frightening,Rare
nation=snorlaxia,The Perfidious Theocracy of Snorlaxia,Left-Leaning College State,Excessive,Frightening,Very Good
nation=alien_magic,The Rogue Nation of Alien Magic,Corporate Police State,Unheard Of,Frightening,Unheard Of
nation=super_bowl_13,The Republic of Super Bowl 13,Father Knows Best State,Some,Frightening,Unheard Of
nation=al-dijaj,The Sultanate of Al-Dijaj,Iron Fist Consumerists,Unheard Of,Frightening,Unheard Of
nation=oslasa23,The Republic of Oslasa23,Iron Fist Consumerists,Few,Frightening,Rare
nation=super_bowl_29,The Republic of Super Bowl 29,Inoffensive Centrist Democracy,Some,Frightening,Some
nation=freddland,The Evil Mad Scientists of Freddland,Iron Fist Consumerists,Few,Frightening,Rare
nation=anemone_reef,The Corporatocracy of Anemone Reef,Anarchy,Superb,Frightening,Superb
nation=barurot,The Free Pink Land of Barurot,Inoffensive Centrist Democracy,Average,Strong,Some
nation=empire_of_lacrimosa,The Rogue Nation of Empire of Lacrimosa,Iron Fist Consumerists,Some,Frightening,Rare
nation=keyser_soze,The Huddled Terrified Masses of Keyser Soze,Capitalizt,Excellent,Frightening,Average
