Unique URL,Nation Name,WA Category,Civil Rights,Economy,Political Freedom
nation=greater_arab_state,The Supreme National Union of Greater Arab State,Psychotic Dictatorship,Outlawed,Frightening,Outlawed
nation=sprinkler,The Armed Republic of Sprinkler,Corporate Police State,Few,Frightening,Rare
nation=andaricus,The Constitutional Republic of Andaricus,Anarchy,Frightening,Frightening,Excessive
nation=oslasa65,The Republic of Oslasa65,Democratic Socialists,Some,Frightening,Below Average
nation=afi-aftos,The Phantasm of Afi-Aftos,Moralistic Democracy,Some,Frightening,Below Average
nation=absentia,The Ongoing State of Absentia,Inoffensive Centrist Democracy,Very Good,Frightening,Below Average
nation=titanfall_2,The Republic of Titanfall 2,Iron Fist Consumerists,Rare,Frightening,Rare
nation=epiaris11,The Republic of Epiaris11,Father Knows Best State,Below Average,Frightening,Rare
nation=temacht,The Krone Bundesrechtsstaat of Temacht,Civil Rights Lovefest,Superb,Frightening,Superb
nation=lernea,The Military Republic of Lernea,Father Knows Best State,Below Average,Frightening,Few
nation=vargr_corsairs,The Confederacy of Vargr Corsairs,New York Times Democracy,Excellent,Frightening,Superb
nation=new_makasta,The United Peoples Democratic RE of New Makasta,Iron Fist Consumerists,Outlawed,Frightening,Rare
nation=epiaris24,The Republic of Epiaris24,Moralistic Democracy,Rare,Frightening,Average
nation=urial63,The Republic of Urial63,Corrupt Dictatorship,Some,Frightening,Few
nation=urial78,The Republic of Urial78,Father Knows Best State,Average,Frightening,Unheard Of
nation=the_authoritarian_republic_of_lochario,The Democratic state of The Authoritarian Republic of Lochario,Inoffensive Centrist Democracy,Excellent,Frightening,Good
nation=peplesania,The Dictatorship of Peplesania,Psychotic Dictatorship,Outlawed,Frightening,Unheard Of
nation=anti-goatsack,The SmallBall Nation of Anti-Goatsack,Inoffensive Centrist Democracy,Excellent,Frightening,Very Good
nation=akheti,The People's Republic of Akheti,Father Knows Best State,Some,Frightening,Unheard Of
nation=scottfire,The Anime 95X Express Bus of Scottfire,Psychotic Dictatorship,Outlawed,Very Strong,Outlawed
nation=german_dragons,The Shadow Legion of German Dragons,Father Knows Best State,Below Average,Frightening,Unheard Of
nation=urial68,The Republic of Urial68,Psychotic Dictatorship,Few,Frightening,Few
nation=roliganistan,The Kongelige Forbund of Roliganistan,Left-Leaning College State,Superb,Frightening,Very Good
nation=vosiycrs,The Dominion of Vosiycrs,Anarchy,Excessive,Frightening,Widely Abused
nation=bloody_scandinavia,The Banking Empire of Bloody Scandinavia,Father Knows Best State,Some,Frightening,Rare
nation=molies3,The Republic of Molies3,Iron Fist Consumerists,Few,Frightening,Unheard Of
nation=white_walker_2,The Rogue Nation of White Walker 2,Father Knows Best State,Some,Frightening,Outlawed
nation=the_botched_pejazzle_of_the_studly_spud,The Half-Baked Abrogation of The Botched Pejazzle of the Studly Spud,New York Times Democracy,Good,Frightening,Superb
nation=davethebastardistan,The Titanic Airship of Davethebastardistan,Civil Rights Lovefest,World Benchmark,Frightening,Superb
nation=raul22,The Republic of Raul22,Psychotic Dictatorship,Some,Frightening,Unheard Of
nation=bogomoln,The Heartland of Bogomoln,Inoffensive Centrist Democracy,Good,Frightening,Average
nation=testing_nation_440,The Republic of Testing nation 440,Iron Fist Consumerists,Few,Frightening,Rare
nation=keronika,The Spring Break Wonderland of Keronika,Capitalist Paradise,Good,Frightening,Very Good
nation=raul45,The Republic of Raul45,Iron Fist Consumerists,Rare,Frightening,Few
nation=sharafiah,The Emirate of Sharafiah,Corporate Police State,Few,Frightening,Rare
nation=raul42,The Republic of Raul42,Iron Fist Consumerists,Some,Frightening,Rare
nation=epiaris25,The Republic of Epiaris25,Iron Fist Consumerists,Rare,Frightening,Few
nation=cruelopolis,The Cruel Republic of Cruelopolis,Psychotic Dictatorship,Outlawed,Frightening,Outlawed
nation=epiaris3,The Republic of Epiaris3,Democratic Socialists,Some,Frightening,Average
nation=super_bowl_38,The Republic of Super Bowl 38,Father Knows Best State,Some,Frightening,Rare
nation=blue_narcissus,The Dazzling Reflection of Blue Narcissus,Corporate Police State,Unheard Of,Frightening,Unheard Of
nation=nargothond,The Most Serene Holy Empire of Nargothond,Corporate Police State,Few,Frightening,Rare
nation=epiaris20,The Republic of Epiaris20,Psychotic Dictatorship,Unheard Of,Frightening,Unheard Of
nation=the_macabees,The Empire of the Golden Throne of The Macabees,Anarchy,Superb,Frightening,World Benchmark
nation=aeshmadeva_land,The People's Jamahiriya of Aeshmadeva Land,Inoffensive Centrist Democracy,Good,Frightening,Excellent
nation=kiasu-ism,The Republic of Kiasu-ism,Inoffensive Centrist Democracy,Average,Frightening,Very Good
nation=molies39,The Republic of Molies39,Father Knows Best State,Good,Frightening,Few
